,Tweet,HS,HS_Individual,HS_Group,HS_Religion,HS_Race,HS_Gender
2967,dwisaso oh salah marah ya,0,0,0,0,0,0
2968,dwioktariyadi iya om marah tau petrus wayang hidung hidup zaman sih,0,0,0,0,0,0
2969,presiden jokowi rumah asing karno buku ujung dunia jiwa cinta tanah air buku hasil ubah semangat merdeka indonesia selamat lahir pancasila,0,0,0,0,0,0
2970,batagor mie juwarakkk,0,0,0,0,0,0
2971,nasi jengkol mie ayam,0,0,0,0,0,0
2972,amin mbak haaa pagiii                 d,0,0,0,0,0,0
2973,tuju pagi mbak ve,0,0,0,0,0,0
2974,amin pagi mbak baby,0,0,0,0,0,0
2975,dewi darmawati bonngbudi wow terima kasih,0,0,0,0,0,0
2976,spill toko pricenya please,0,0,0,0,0,0
2977,ta t,0,0,0,0,0,0
2978,kakak eril pintar weh ayo,0,0,0,0,0,0
2979,selamat pagi pulici                 si,0,0,0,0,0,0
2980,santorinissun maaf,0,0,0,0,0,0
2981,adies percaya mampu tenggelam temu minggu moga a eril temu cepat moga selamat,0,0,0,0,0,0
2982,adies alat canggih bunda kualitas,0,0,0,0,0,0
2983,bah,0,0,0,0,0,0
2984,kang emil doa baik semesta baik hati a eril yuk pulang,1,1,0,0,0,0
2985,bangsat aman ya,1,0,1,0,0,0
2986,hem                 h,0,0,0,0,0,0
2987,bayar pajak bu smi kelola infrastruktur bangun basuki salah guna pajak from this to this,0,0,0,0,0,0
2988,waahh terima kasih cantik banget warna                 ys,0,0,0,0,0,0
2989,amin,0,0,0,0,0,0
2990,ridwan kamil innalilahi wa inna ilaihi raji uji nasional al fatihah rasa duka amat,0,0,0,0,0,0
2992,panggil pawang hujan,0,0,0,0,0,0
2993,ribu duit bulu enak banget pungut liar,0,0,0,0,0,0
2994,ya allah kang emil kiat kang emil kiat,1,1,0,0,0,0
2995,ngulamak sesuai pesan undang contoh undang om prabowo pas calon presiden,0,0,0,0,0,0
2996,amin                 z,0,0,0,0,0,0
2997,ya ban eh wakil,1,0,1,0,0,0
2998,tuju andal ya mudah an temu a eril,0,0,0,0,0,0
2999,tuju presiden periode butuh pimpin zaman sepe i temu akun jokowi                 ly,0,0,0,0,0,0
3000,ssttt koh ndrews punten simpang kemarin ramai dibully ssan twitnya kah,0,0,0,0,0,0
3001,iya terima kasih cak sys ya kabar sahabat sehat banget ditwitter,0,0,0,0,0,0
3002,sembah tuhan wajib sunnah sembah ego nalar,1,1,0,1,0,0
3003,amin anak,0,0,0,0,0,0
3004,somad tel ludah ya                 yw kyu zf,0,0,0,0,0,0
3005,bukti anak wali kota solo presiden jokowi                 k,0,0,0,0,0,0
3006,o,0,0,0,0,0,0
3007,moga sembuh,0,0,0,0,0,0
3008,monsterhiphoop,0,0,0,0,0,0
3009,acieee kadrun sakit hati deh                 z ayah,0,0,0,0,0,0
3010,selamat ulang buya al fatihah                 a,0,0,0,0,0,0
3011,horeee balon selamat ulang om elly umur sehat sukses hip hip huraaa,0,0,0,0,0,0
3012,teh dulunya pacar angelina sondakh tah cmiww,1,1,0,0,0,0
3013,santorinissun bang sehat bang mana,0,0,0,0,0,0
3014,amin selamat pagi,0,0,0,0,0,0
3015,semesta baik hati,1,1,0,0,0,0
3016,o kang emil teh cinta,1,1,0,0,0,0
3017,amin,0,0,0,0,0,0
3018,cermin,0,0,0,0,0,0
3019,selamat pagi halo sungai aaree indonesia sapa tolong kembali a eril bawa pulang please,0,0,0,0,0,0
3020,from this to this data nasehat minta maaf materai ceban pulici banget,0,0,0,0,0,0
3021,cakap banget,0,0,0,0,0,0
3022,amin                 k,0,0,0,0,0,0
3023,spill,0,0,0,0,0,0
3024,catchmeupid ridwan kamil                 k mhzrgt,0,0,0,0,0,0
3025,al fatihah                 k mhzrgt,0,0,0,0,0,0
3026,amin,0,0,0,0,0,0
3027,k mhzrgt,0,0,0,0,0,0
3028,amin sepe i cari a eril                 gie event organizer,0,0,0,0,0,0
3029,catchmeupid ridwan kamil amin hatur terima kasih                 gie event organizer,0,0,0,0,0,0
3030,amin hatur terima kasih teh intan selamat sonten                 ln o,0,0,0,0,0,0
3031,amin demam mbak,0,0,0,0,0,0
3032,amin hatur terima kasih,0,0,0,0,0,0
3033,betanic agung catchmeupid ridwan kamil mari doa a eril                 fd,0,0,0,0,0,0
3034,iya,0,0,0,0,0,0
3035,bieb hatur terima kasih,0,0,0,0,0,0
3036,amin sugeng sonten mbak retno                 wkwk,0,0,0,0,0,0
3037,empat kawan mohon ikhlas doa eril,1,1,0,0,0,0
3038,gigit drakula sepe i,0,0,0,0,0,0
3039,ridwan kamil please be ahan,0,0,0,0,0,0
3040,mbieb wagimandeep,0,0,0,0,0,0
3041,detikcom anaklolina mbak akun,0,0,0,0,0,0
3042,asyik goodlooking milik orang,0,0,0,0,0,0
3043,iya pintar,0,0,0,0,0,0
3044,pagi om dicky                 sc,0,0,0,0,0,0
3045,yess alih undang ngulamak basuki pilih undang tentara nasional indonesia latih calon pegawai negeri sipil menteri kerja rumah rakyat bela negara,0,0,0,0,0,0
3046,neng sofyy beruang puttih amin,0,0,0,0,0,0
3047,ngupi drun kemarin nyinyir turun nyinyir jodoh tang tuhan atur mending urus hidup oke,1,1,0,0,0,0
3048,o oh iya pagi koh albe,0,0,0,0,0,0
3049,pagi bos                 wdd j hr,0,0,0,0,0,0
3050,uraaaa nyam nyam nyam nasi kota solo wali kota nih warga solo                 qr,0,0,0,0,0,0
3051,benar dengar,0,0,0,0,0,0
3052,selamat istirahat moga cepat reda demam minum air putih                 tg,0,0,0,0,0,0
3053,jalan dewasa,0,0,0,0,0,0
3054,eril mana nak                 re,0,0,0,0,0,0
3055,irwan ya atuh,1,1,0,0,0,0
3056,nies                 as,0,0,0,0,0,0
3057,mbak undang nyinyir hajat suara keras musik dipe imbang tau,0,0,0,0,0,0
3058,tau sakit nama dvt cari google kakak oke moga terus cepat sembuh sehat semangat ya amin,0,0,0,0,0,0
3059,sakit dvt punten,0,0,0,0,0,0
3060,sakit kakak oke,0,0,0,0,0,0
3061,pakai oil kangmas oles buncit hari jamin minggu kilau buncit,0,0,0,0,0,0
3062,monsta monsterhiphoop,0,0,0,0,0,0
3063,amin beliau pergi pulang,0,0,0,0,0,0
3064,ge,0,0,0,0,0,0
3065,yess,0,0,0,0,0,0
3066,sepe inya menteri undang ceramah anu                 m si,1,0,1,0,0,0
3067,semangaattt,0,0,0,0,0,0
3068,ajak married ogah,0,0,0,0,0,0
3070,cantik,0,0,0,0,0,0
3071,lucknuut kangmas malam berita sore,0,0,0,0,0,0
3072,tunggu wakil gubernur bicara                 jq,0,0,0,0,0,0
3073,bawa nama indonesia andai beliau gubernur                 uy sip iya,1,0,1,0,0,0
3074,santorinissun blokir euy,0,0,0,0,0,0
3075,mana ya deh                 o,0,0,0,0,0,0
3076,amin doa baik eril moga temu selamat,0,0,0,0,0,0
3077,b o c i l calon presiden                 si,0,0,0,0,0,0
3078,gemas pergi bulu hidung pakai biar nge i bloin,0,0,0,0,0,0
3079,listyosigitp mohmahfudmd divhumas polisi republik indonesia tolong akun ya min,0,0,0,0,0,0
3080,mu buya cmiww malam minggu pantau twitter,0,0,0,0,0,0
3081,gus romo buya terus langkah beliau jaga rukun umat agama negeri                 iya,0,0,0,0,0,0
3082,w,0,0,0,0,0,0
3083,rg kemarin salat,0,0,0,0,0,0
3084,waalaikum salam pagiii,0,0,0,0,0,0
3085,pagiiii patah                 online,0,0,0,0,0,0
3086,jadi peluang kembang are more tahan think basuki latih bela negara wujud cinta tanah air pagiiii                 f wj,0,0,0,0,0,0
3087,akun akun mbak,1,1,0,0,0,0
3088,sungai sungai swiss moga eril cepat temu sehat,0,0,0,0,0,0
3089,iya,0,0,0,0,0,0
3090,mbak rara terima kasih koh misuh pagi banget,0,0,0,0,0,0
3091,linknya kah mbak rara koh,0,0,0,0,0,0
3092,awan oke deh,1,1,0,0,0,0
3093,bah,0,0,0,0,0,0
3094,duka kental,0,0,0,0,0,0
3095,orang kenang baik,1,0,1,0,0,0
3096,halo whiskey,0,0,0,0,0,0
3097,suri,0,0,0,0,0,0
3098,siang mbak sus                 y,0,0,0,0,0,0
3099,jaga jati bangsa indonesia,0,0,0,0,0,0
3100,beliau ulama                 rd,0,0,0,0,0,0
3101,buya tiada suri teladan al fatihah innalilahi wa inna ilaihi raji uji nasional                 l,0,0,0,0,0,0
3102,amin,0,0,0,0,0,0
3103,innalilahi wa inna ilaihi raji uji nasional selamat jalan haribaan buya indonesia duka                 k,0,0,0,0,0,0
3104,innalilahi wa inna ilaihi raji uji nasional pulang tenun bangsa,0,0,0,0,0,0
3105,monsta monsterhiphoop cute,0,0,0,0,0,0
3106,ridwan kamil amin,0,0,0,0,0,0
3107,selamat pagi,0,0,0,0,0,0
3108,wijiatno notomiharjo                 mltwyez k,0,0,0,0,0,0
3109,jam cari kamis swiss moga temu amin,0,0,0,0,0,0
3110,msaid didu wijiatno notomiharjo bos sebar hoaks dosa                 mltwyez k,0,0,0,0,0,0
3112,k langsung ambil piring mam,1,1,0,0,0,0
3113,iya mbak sus oh iya selamat raya naik kristus ya damai hati                 k,1,0,1,0,0,0
3114,cute it si a little,0,0,0,0,0,0
3115,dukacita mbak lina,0,0,0,0,0,0
3116,buaya bisa nyeret ngelempar guling mati potong cabik mangsa selamat deh kura                 p ds,0,0,0,0,0,0
3117,orang munafik partai adil sejahtera,1,0,1,0,0,0
3118,jokowi hatur terima kasih gambar hormat,0,0,0,0,0,0
3119,kotak suara buka tempat saksi eyel sila lapor biar proses,0,0,0,0,0,0
3120,sepe i petik sawit sih daun nya ya nya panjat                 r,1,1,0,0,0,0
3121,perintah kota solo pakai rapi sopan harga kunjung,0,0,0,0,0,0
3122,banget ambil pakai buah banget,0,0,0,0,0,0
3123,id boleee sebut merek,0,0,0,0,0,0
3124,indonesia selamat kakak nurul                 ju,0,0,0,0,0,0
3125,galau muluk pagi,0,0,0,0,0,0
3126,amin semangaattt,0,0,0,0,0,0
3128,aelteraego deangrh,0,0,0,0,0,0
3129,aelteraego deangrh kuat otak weeehhh sembarang favorit,0,0,0,0,0,0
3130,madebylaluna dennysiregar tanggung nih tambah sangka bela koruptor ya tagar bebas juli batubara bla bla bla koruptor bangsat ai mana beda kaum salah bela pikir,1,0,1,0,0,0
3131,alhamdulillah,0,0,0,0,0,0
3132,aelteraego deangrh sekolah dasar ajar toleransi negeri,0,0,0,0,0,0
3133,kadrun singapura bahagiyak                 yw,1,0,1,0,0,0
3134,selamat pagi,0,0,0,0,0,0
3135,waahh jam rumah,0,0,0,0,0,0
3137,deangrh sekolah dasar ku tabur,0,0,0,0,0,0
3138,rencana tuhan indah baik et labora pagi kak oke have a nice day burung                 e,0,0,0,0,0,0
3139,ekowboy ganjarpranowo mam drun                 oq,0,0,0,0,0,0
3140,sifat takut kalah panggung,0,0,0,0,0,0
3141,ganjarpranowo main deh akun ganjar situ te ulis cermat langkah tangan banjir allah                 q,0,0,0,0,0,0
3142,manja,1,0,1,0,0,0
3143,santorinissun yodah bye,0,0,0,0,0,0
3144,adik sayang sih,0,0,0,0,0,0
3145,santorinissun tangan kerja kadrun tau proses tau protes,0,0,0,0,0,0
3146,indonesia ya mabuk agama,1,1,0,0,0,0
3147,bawa bag keren adeknya,0,0,0,0,0,0
3148,ngawal kerja pakde ngamati calon gadang gadang ganjar banjir allah semarang anies formula e nya lihat kerja                 h do,0,0,0,0,0,0
3149,ketemu mbak habis bensin kadang hidup lucu,0,0,0,0,0,0
3150,andai john siang kawan                 ly,1,0,1,0,0,0
3151,fadli zon kecewa on,1,1,0,0,0,0
3152,leonita lestari ya iya politik urus orang gede pangan bahagiyak syukur utang negara bu smi urus utang ya bayar                 t,0,0,0,0,0,0
3153,tuduh kafeeerrr ya tinggal syahadat repot agama lupa manusia                 jj,0,0,0,0,0,0
3154,utang negara sepe i nalar alat politik serang perintah simpel rakyat retjeh bayar pajak taat atur nikmat fasilitas sedia ibadah tenang bahagia                 h h,0,0,0,0,0,0
3155,kocheng,0,0,0,0,0,0
3156,halo,0,0,0,0,0,0
3157,min hati baik hapus twit,0,0,0,0,0,0
3158,sakit normal ya sih an,0,0,0,0,0,0
3159,al fatihah,0,0,0,0,0,0
3160,asyik politik tebar pesona mending kayak mbak maudy ayunda sat set sat set langsung pelamin kerja kerja kerja sat set sat set rakyat pilih presiden kayak kawal jabat                 b,0,0,0,0,0,0
3161,busuk                 p a h,0,0,0,0,0,0
3162,alhamdulillah amin selamat ya baby sena,0,0,0,0,0,0
3163,kriuk sambelnya,0,0,0,0,0,0
3164,tauknya ku minyak goreng,0,0,0,0,0,0
3165,sant tingwe fadli zon ikan buntel jodoh laksana kembar,0,0,0,0,0,0
3166,waahh sekali nungul bikin iler bryno tah,0,0,0,0,0,0
3167,fj,0,0,0,0,0,0
3168,kode suami istri,0,0,0,0,0,0
3171,cakap ya,0,0,0,0,0,0
3172,andikamalreza we neng tuman,0,0,0,0,0,0
3173,cewek bawa ransel budak cinta,0,0,0,0,0,0
3174,be ambah selamat mbak maudy ayunda                 e l,1,1,0,0,0,0
3175,anaklolina sipil militer kangmas biar andika wakil presiden,0,0,0,0,0,0
3176,alhamdulillah senang anies halal bihalal hadir lamar tunda tunda selamat moga lancar berkah acara lamar putri sulung mutiara annisa baswedan                 rm,0,0,0,0,0,0
3177,efek sehat tubuh ya butuh malam istirahat,0,0,0,0,0,0
3178,jokowi manusia buk iriana pandang trump sorot mata jokowi akan awas trump cakep buk iriana berani urus                 jv yc,0,0,0,0,0,0
3179,madebylaluna andikamalreza neng maaf kang agus ya om marah pikir,1,1,0,0,0,0
3180,pindah server langsung ganteng ya,0,0,0,0,0,0
3181,telunjuk biar jokowi tenang menteri bantu sesuai tugas hasil kerja bera i negeri                 i,0,0,0,0,0,0
3182,bikin sih suami marah nasi sengaja senggol baju sang istri                 tg,0,0,0,0,0,0
3183,aktif orang doang bahan bicara garing laut hubung kayak ngabisin,1,1,0,0,0,0
3184,kuaaattt mbak titip,1,1,0,0,0,0
3186,gemas banget deh puppy tinggal tulang,0,0,0,0,0,0
3187,halo adeknya gigit puppy nya tah mbak,0,0,0,0,0,0
3188,aliansi timur mentwit ya bang aliansi done follow,0,0,0,0,0,0
3190,anakkolong iya contoh om prabowo presiden                 rupiah,1,0,1,0,0,0
3191,buruk muka cermin belah                 g h,0,0,0,0,0,0
3192,kota barus presiden jokowi politik agama pisah umat indonesia kota barus titik nol islam nusantara,0,0,0,0,0,0
3193,wagimandeep basaillive done,0,0,0,0,0,0
3194,sok                 su,1,1,0,0,0,0
3195,ganjar wakil presiden andika ahok bu smi,0,0,0,0,0,0
3196,kafeeerrr hadiiirrr,0,0,0,0,0,0
3197,moga pas kayak,0,0,0,0,0,0
3198,ngustadz gue sedia                 ama,0,0,0,0,0,0
3199,omdickyajah tajam ya ganteng,1,1,0,0,0,0
3200,prastow amin,0,0,0,0,0,0
3201,ciri khas beliau batik                 z,0,0,0,0,0,0
3202,santorinissun lihat beras sumedang daerah khusus ibukota kerja kota beras linknya,0,0,0,0,0,0
3203,innalilahi wa inna ilaihi raji uji nasional al fatihah orang bicara baik covid reda yuri kenang selamat jalan yuri damai haribaan                 orang hati,0,0,0,0,0,0
3204,biar mas gibran ajar bu risma ganjar ri,0,0,0,0,0,0
3205,enny endah aewin risma daerah khusus ibukota gibran wali kota semarang biar wali kota semarang gubernur jawa ganti ganjar,0,0,0,0,0,0
3206,netizens gerak cepat                 mb,0,0,0,0,0,0
3207,leonita lestari listy a inya mas,0,0,0,0,0,0
3208,pakai masker tambah ganteng mas gibran                 p,0,0,0,0,0,0
3209,halo,0,0,0,0,0,0
3210,pe amina ya sukses mandalika,0,0,0,0,0,0
3211,telunjuk jokowi ojek online gesa gesa dukung,0,0,0,0,0,0
3212,kakakeyo djajakus soraya fadyanova alvaruslina amin al fatihah,0,0,0,0,0,0
3213,amin,0,0,0,0,0,0
3214,ekokuntadhi sayang gue cowok tolol domba sesar mata domba operasi kupi gue bilang kupi ya kupi mabuk sianida,1,0,1,0,0,0
3216,moga senyum ya mbak                 k atr,0,0,0,0,0,0
3217,leonita lestari listy kunci ya,0,0,0,0,0,0
3218,foto kocheng semangat mbak,0,0,0,0,0,0
3219,ekokuntadhi biasa asih khusus untuk kupi campur sianida dikiiiittt,0,0,0,0,0,0
3220,listy biak bos habis ketemu mas elon bahas space biak undang khusus and for your information biak kali survei cocok stasiun lihat keris taruh jokowi coba                 t,0,0,0,0,0,0
3221,ya gesa gesa timbul tengah dukung kerja tuntas pesan basuki menteri bangga,1,0,1,0,0,0
3222,johnhendrik nih obrol bang teman mbak puspa,0,0,0,0,0,0
3223,hadeehhh mbaaakkk,0,0,0,0,0,0
3224,ekokuntadhi,0,0,0,0,0,0
3225,johnhendrik,0,0,0,0,0,0
3226,ccicpolri divhumas polisi republik indonesia asa tau kenal senggol bawa asa                 yu,0,0,0,0,0,0
3227,johnhendrik oh,0,0,0,0,0,0
3228,sugeng siang mas                 ab,0,0,0,0,0,0
3229,aryprasetyo rizmaya yradianto c r main tik tok,0,0,0,0,0,0
3230,johnhendrik mutualan mbak taruh kalah rambut kilau deh cmiww cerita mumpung santai sibuk,0,0,0,0,0,0
3231,johnhendrik,0,0,0,0,0,0
3232,johnhendrik mbak,0,0,0,0,0,0
3233,prastow amin,0,0,0,0,0,0
3234,c ajimahameru eh bidadari mungil banget,0,0,0,0,0,0
3235,arang sajak banget roy ngamati kerja rekam jejak,1,0,1,0,0,0
3236,tunggu umum komisi pemelihan ngamati kerja calon gadang gadang presiden dukung jokowi jabat                 l,0,0,0,0,0,0
3237,puspaswarna biar mbak puspa,0,0,0,0,0,0
3238,mbak puspaswarna cmiww,0,0,0,0,0,0
3239,hadiiirrr pagi                 ns,0,0,0,0,0,0
3240,sepe inya aja boikot somad naik kunjung wisatawan singapura anggap negara peduli aman warga indonesia                 i,0,0,0,0,0,0
3242,waa bagi,0,0,0,0,0,0
3243,joko gusman ekokuntadhi pamit hidup main twitter rl mesti imbang cu happy pekan sehat waras semangat,0,0,0,0,0,0
3244,joko gusman ekokuntadhi bicara tutup formula e singapura ya                 os,1,1,0,0,0,0
3245,joko gusman ekokuntadhi cerah                 si,1,1,0,0,0,0
3246,oh mama doggy satu lihat,0,0,0,0,0,0
3247,titip in ya gemoyy bangeeetttt,0,0,0,0,0,0
3248,izin mentwit basuki infrastruktur ya min ambil pagiiii                 vr f f,0,0,0,0,0,0
3249,guling bulu nih nama,0,0,0,0,0,0
3250,somad atuh,1,1,0,0,0,0
3251,saropudinade ekokuntadhi ganti esemka proyek susilo bambang yudhoyono roy sukro oh ya mobdin wali kota semarang tentara nasional indonesia au pakai esemka lo                 yrblqw t c,1,0,1,0,0,0
3252,saropudinade ekokuntadhi rawan menteri korupsi ya hukum pandang bulu udahan nih bahas somad bonus nih                 iya,1,1,0,0,0,0
3253,ekokuntadhi mas menteri rencana masuk mas eko info iya salah bius be dimedsos waras kalah                 p,0,0,0,0,0,0
3254,aamiinkan,0,0,0,0,0,0
3255,pagiii mbak bandit psi,0,0,0,0,0,0
3256,sergio ekokuntadhi islam bela uji semester singapura rangka dakwah undang tugas negara,1,0,1,1,0,0
3257,saropudinade ekokuntadhi somad,0,0,0,0,0,0
3258,saropudinade ekokuntadhi alih isu pe pikir senang jadi rusak hubung tetangga pikir kesana ya,0,0,0,0,0,0
3259,sipil militer,0,0,0,0,0,0
3260,saropudinade ekokuntadhi nih tambah hukum pikir dukung perintah sah bera i dukung koruptor tagar save juli batubara save mas bela akal sehat emosi                 k c,0,0,0,0,0,0
3261,asyik,0,0,0,0,0,0
3262,om simak nih,0,0,0,0,0,0
3263,selamat pagi nusantara,0,0,0,0,0,0
3264,djajakus soraya fadyanova alvaruslina innalilahi wa inna ilaihi raji uji nasional al fatihah moga ibunda hj baik sis keluarga tinggal tabah dukacita,0,0,0,0,0,0
3265,ekokuntadhi                 c e,0,0,0,0,0,0
3266,ngabisin susu strawberry,0,0,0,0,0,0
3267,bangun tidur tidur sore,0,0,0,0,0,0
3268,selamat pagi selamat ulang tetap sehat tetap kuat rencana sungguh                 r,0,0,0,0,0,0
3269,hadiiirrr,0,0,0,0,0,0
3270,ekokuntadhi negara provokasi mas eko lebay,0,0,0,0,0,0
3271,ekokuntadhi presiden singapura muslim jadi mustahil negara daftar hitam                 il,1,0,1,0,0,0
3272,orang singapura niat,1,1,0,0,0,0
3273,ekokuntadhi madura ya ini darah makan haram bera i tindak nya negara daftar hitam tindak negara daftar hitam,1,0,1,0,0,0
3274,ekokuntadhi tuan rumah tolak paksa                 gue k o sn,0,0,0,0,0,0
3275,ekokuntadhi cina kafir,1,1,0,1,1,0
3276,saropudinade ekokuntadhi tangkap tahan bukti perintah jokowi korupsi cebong indikator kualitas lingkung cikal hewan be asbih rabbnya                 wphhhsinsg,1,1,0,0,0,0
3277,bandit santorinissun surga urus mulut jaga,0,0,0,0,0,0
3278,ekokuntadhi kira,0,0,0,0,0,0
3279,tau mbak rara tau sewa,0,0,0,0,0,0
3280,santorinissun sewa rugi bandar,0,0,0,0,0,0
3281,nyaiibubu c ajimahameru kecebong be asbih rabbnya islam indikator lingkung lingkung cemar kecebong                 wphhhsinsg,1,1,0,0,0,0
3282,c ajimahameru makan darah tulis makan darah bera i makan marus makan marus haram umat muslim kocak,0,0,0,0,0,0
3283,singapura,1,0,1,0,0,0
3284,gubernur                 cd f,0,0,0,0,0,0
3285,ekokuntadhi iya ya,0,0,0,0,0,0
3286,kayak                 maaf t iya,0,0,0,0,0,0
3288,tuhan suka                 vy jvg it,0,0,0,0,0,0
3289,ekokuntadhi terima kasih maki diri,0,0,0,0,0,0
3290,ekokuntadhi bela orang pura tau tuju fi bego tembus batas hus hus hus pergi,1,1,0,0,0,0
3291,ekokuntadhi bonus nih kadrun goblok tuduh era presiden jokowi nih baca bacot                 skzcobgti,1,1,0,0,0,0
3292,wiena kinasih alisyarief ica singapura drun                 skzcobgti,1,0,1,0,0,0
3293,ekokuntadhi jawab oke pe anyaan sederhana tuju somad singapura,0,0,0,0,0,0
3294,ekokuntadhi gobblokkk dampak somad indonesia,0,0,0,0,0,0
3295,guna masker disiplin pola hidup sehat,0,0,0,0,0,0
3296,ekokuntadhi sepe i tau dampak somad indonesia                 kf,0,0,0,0,0,0
3297,saropudinade ekokuntadhi                 b ag p,0,0,0,0,0,0
3298,ekokuntadhi pindah gih gurun,0,0,0,0,0,0
3299,ngawal jokowi                 bas,0,0,0,0,0,0
3300,eh jamin an mutu pikir                 pp,1,1,0,0,0,0
3301,office boy p,0,0,0,0,0,0
3302,innalilahi wa inna ilaihi raji uji nasional al fatihah dukacita dalam dalam moga almarhum baik sis amin keluarga tinggal tabah,0,0,0,0,0,0
3303,erickthohir erick catat calon presiden ganti jokowi                 o,0,0,0,0,0,0
3304,cowok pintar beli gratis,0,0,0,0,0,0
3305,islam golong masuk surga agama hati akal,0,0,0,0,0,0
3306,saudara kawan,0,0,0,0,0,0
3307,tajam asah temu ketemu rencana tuhan indah                 h,1,1,0,0,0,0
3308,kocak komennya,0,0,0,0,0,0
3309,dwioktariyadi space hubung indonesia,0,0,0,0,0,0
3310,calon mantu,0,0,0,0,0,0
3311,sapi pagi mbak nancy                 gue,0,0,0,0,0,0
3313,acieee ayo ayo ayo,0,0,0,0,0,0
3314,anies kh,1,0,1,1,0,0
3315,ikut gue malu ya                 hu qk,0,0,0,0,0,0
3316,makna bangkit asa negatif positif bangkit selamat bangkit kawan ayo bangkit                 thread starter,0,0,0,0,0,0
3317,selamat anjing kang agus                 gue,1,1,0,0,0,0
3318,kristen,0,0,0,0,0,0
3319,asmara anies bonus,1,0,1,0,0,0
3320,pagiiii,0,0,0,0,0,0
3321,gue bicara perangin islam pakai huruf kapital agama ya hormat agama gue perangin ngulamak tebar benci hoaks,1,1,0,1,0,0
3322,edit mbak                 ib,0,0,0,0,0,0
3323,hasan ceramah provokator iya,0,0,0,0,0,0
3324,oy,0,0,0,0,0,0
3325,diam vaksin,0,0,0,0,0,0
3326,congratz,0,0,0,0,0,0
3327,j,0,0,0,0,0,0
3328,tahu ya                 yrblqw t c,0,0,0,0,0,0
3329,iya mutualan sahabat asyik lo orang bobby risakotta,0,0,0,0,0,0
3330,cupidlucky ajar singapura be indak somad munafik haram vaksin syarat pergi vaksin,0,0,0,0,0,0
3331,air putih telah lupa sikat gigi biar gigi bersih,0,0,0,0,0,0
3332,santorinissun cek batang jawa,0,0,0,0,0,0
3333,kresna santorinissun september oh ya gue peduli masyarakat tindak kecuali,1,1,0,0,0,0
3334,bashofi basyirppib msaid didu yodah pakai logika ya bumi allah minggu pakai mesjid ya bakti,0,0,0,0,0,0
3335,ariefnott inkaputri bobbyandhika,0,0,0,0,0,0
3336,bashofi basyirppib msaid didu bumi allah atur tiap negara negeri pakai renang diam,0,0,0,0,0,0
3337,ariefnott inkaputri bobbyandhika hmmmm golong,0,0,0,0,0,0
3338,ariefnott inkaputri bobbyandhika cup pe anggungjawabkan ya allah sumpah te inggi muslim,0,0,0,0,0,0
3339,ariefnott inkaputri bobbyandhika allah,0,0,0,0,0,0
3340,ariefnott inkaputri bobbyandhika allah,0,0,0,0,0,0
3341,bobby risakotta amin,0,0,0,0,0,0
3342,yess sahabat bang bir bang bobby risakotta asyik orang beliau kenal trinity bang bir,1,1,0,0,0,0
3343,ariefnott inkaputri bobbyandhika malu bang lebaran selesai bikin hoaks sila pe anggungjawabkan jempol waktu adil te inggi,0,0,0,0,0,0
3344,jalan tempat,0,0,0,0,0,0
3345,santorinissun diketawain bangkeee                 ks,0,0,0,0,0,0
3346,jokowi indonesia trinity korban bom samarinda bintang bangkit tata hidup,0,0,0,0,0,0
3347,bayang,0,0,0,0,0,0
3348,leonita lestari the new front bela islam                 h,0,0,0,0,0,0
3349,pagi frankz                 z,0,0,0,0,0,0
3350,guna tengkar gara                 fz,0,0,0,0,0,0
3351,santorinissun,0,0,0,0,0,0
3352,sekak ster                 si cx,0,0,0,0,0,0
3353,rapi  pulang monstaaaaaa pulaaangg,0,0,0,0,0,0
3354,dauph bonus nih                 o b r,1,1,0,0,0,0
3355,yess,0,0,0,0,0,0
3356,msaid didu ya,0,0,0,0,0,0
3357,film baru sila pic fannya sayang                 bawa,1,1,0,0,0,0
3358,raya ulang negara kafeeerrr dobel salah dasar ngustadz bangkeee bikin ribet,1,1,0,0,0,0
3360,yan ubah cute syuting c the tayang syuting                 k,0,0,0,0,0,0
3361,ajar agama islam rasulullah ajar ketuk pintu izin pasuk rumah orang izin paksa masuk selamat pagi indonesia,0,0,0,0,0,0
3363,monsterhiphoop,0,0,0,0,0,0
3364,jintogel ha suka a,0,0,0,0,0,0
3365,tinggal tunggu benar demo ujung nya salah turun jokowi                 vv,1,1,0,0,0,0
3366,jalan jalan                 oj c wy,0,0,0,0,0,0
3367,jintogel centil banget hayo suka,0,0,0,0,0,0
3368,leonita lestari dewan wakil rakyat daerah banyak ai pedeipeh,0,0,0,0,0,0
3369,coba monsta monsterhiphoop hal tuju bla bla bla ifikasi halal,1,0,1,0,0,0
3370,perlu wisata halal tugas guide umat muslim mam mesjid tawar wisata asyik                 e,0,0,0,0,0,0
3371,ya                 p p,0,0,0,0,0,0
3372,licik salah eh ajak umat boikot dana kapal selam urus                 h,1,0,1,1,0,0
3373,bah tenggelam atuh,0,0,0,0,0,0
3374,batagor,0,0,0,0,0,0
3375,leonita lestari front bela islam gaya,0,0,0,0,0,0
3376,bicara sih,1,1,0,0,0,0
3377,buset guling bulu,0,0,0,0,0,0
3378,adab bicara beda,0,0,0,0,0,0
3379,mata keren hijau,0,0,0,0,0,0
3380,mbak tuhan yesus mei bentar angkat surga dunia kepooo,0,0,0,0,0,0
3381,yess hasil,0,0,0,0,0,0
3382,pagiiii from this to this basuki keren ya menteri sayang beliau ketua satu olga indonesia tau                 lawan tn,0,0,0,0,0,0
3383,hem,0,0,0,0,0,0
3384,selamat raya waisak mas bro,0,0,0,0,0,0
3385,sore,0,0,0,0,0,0
3386,yesss,0,0,0,0,0,0
3387,serasa raya waisak,1,1,0,0,0,0
3388,mbaaakkk cepat sembuh ya,0,0,0,0,0,0
3389,upil bang hidung selesai hidup,0,0,0,0,0,0
3390,panggil mas nama doang nih gue panggil                 hi h,0,0,0,0,0,0
3391,es,0,0,0,0,0,0
3394,marah marahiiinnn,0,0,0,0,0,0
3395,twit follow paham sisi,0,0,0,0,0,0
3396,bonus teriak turun jokowi,1,1,0,0,0,0
3398,ganteng,0,0,0,0,0,0
3399,demo siang gala dinner malam iman imin imbang                 e h gue,0,0,0,0,0,0
3402,iya negara hak lindung warga anggap ancam nih ngustadz sepe i ngelempar bola panas kayak alam depo asi                 j,0,0,0,0,0,0
3403,kanan kidal,0,0,0,0,0,0
