,Tweet,HS,HS_Individual,HS_Group,HS_Religion,HS_Race,HS_Gender
4248,iya                 woq,0,0,0,0,0,0
4249,anakkolong maksud,0,0,0,0,0,0
4250,hidup berkat                 vb,1,0,1,0,0,0
4251,gue salah satu,0,0,0,0,0,0
4252,juang mama rosa now i,0,0,0,0,0,0
4253,mantap,0,0,0,0,0,0
4254,good news senang bagi positif,1,1,0,0,0,0
4255,coba monsta aahhh monsterhiphoop budak cinta kayak,0,0,0,0,0,0
4256,emmm punten berat hak anak asuh kandung cmiww negara,0,0,0,0,0,0
4257,amin terima kasih cantik mata                 h,0,0,0,0,0,0
4258,salahsambungya bilang ya kristen gurun iya ngamati ajar,0,0,0,0,0,0
4259,terima kasih sayang lindung ya saudara badak jawa asli indonesia bulu jenis badak kecil,0,0,0,0,0,0
4260,sambal bikin minyak goreng kelapa sunda nama,1,0,1,0,0,0
4261,salahsambungya mentwit baby badak ya nge i ikut bicara salah,0,0,0,0,0,0
4262,palkon                 ubeuhvaisj,0,0,0,0,0,0
4263,ekor                 tu,0,0,0,0,0,0
4264,santorinissun yess badak sumatra badak bulu asli indonesia badak jawa punah cmiww,0,0,0,0,0,0
4265,oh iya tetangga tuuuhhh                 hm,0,0,0,0,0,0
4266,iya terima kasih                 p,0,0,0,0,0,0
4267,pagi bunda iya mama lihat mata belok,0,0,0,0,0,0
4268,amin terima kasih ya tolong buru cula cula sepe i kuku manusia                 l k,0,0,0,0,0,0
4269,kasihan mama pas lahir cula,0,0,0,0,0,0
4270,dokter awan dokter kaleng                 rr,1,1,0,0,0,0
4271,yesss of pagi                 f,0,0,0,0,0,0
4272,bang jimmy selamat pagi                 vd,0,0,0,0,0,0
4273,yess pagi mbak                 f,0,0,0,0,0,0
4274,emak badak kayak senyum ya emak badak bangga,1,1,0,0,0,0
4275,pagi frankz lucu ya,0,0,0,0,0,0
4276,pagi                 h al,0,0,0,0,0,0
4277,pagi kenal nih baby baby badak sumatra lahir way jenis kelamin betina mama nama rosa papa ekor cula tumbuh gede                 undang undang,0,0,0,0,0,0
4278,riweuh mbok jual,0,0,0,0,0,0
4279,belah z,1,0,1,0,0,0
4280,garam air rebus,0,0,0,0,0,0
4281,aki kambing,1,1,0,0,0,0
4282,andika,0,0,0,0,0,0
4283,wan orang alah pangling lihat ava barusan pakai,0,0,0,0,0,0
4284,monstaaaaaa monsterhiphoop,0,0,0,0,0,0
4285,dukacita,0,0,0,0,0,0
4286,dokter awan kenal dokter humble inovasi bidang dokter ragu metode cuci otak vaksin nusantara inovasi beliau buat pecat                 h,0,0,0,0,0,0
4287,bagus,0,0,0,0,0,0
4288,sih yess                 he,0,0,0,0,0,0
4289,pagi mbak diajeng,0,0,0,0,0,0
4290,selamat pagi,0,0,0,0,0,0
4291,pagi nusantara                 wj p,0,0,0,0,0,0
4292,tangan bilang indonesia,0,0,0,0,0,0
4293,picoez gaya twit nya halus senyum khas gigi gingsul salah kagum ditwitter jarang jbjb lebaran suka lo twitter sehat ya mprop salim,0,0,0,0,0,0
4294,picoez mprop picoez adik angkat jokowi jago obrol tumbuh boleee rokok rumah bangun ndalem biar rokok hasil obrol tumbuh buku komisaris cmiww                 k,0,0,0,0,0,0
4295,acieee bikin bang ndrews romantis                 h,0,0,0,0,0,0
4296,ijo kelapa sawit tabur tabur kelapa nampol iseng tanggung,1,0,1,0,0,0
4297,goreng hitam saran sih kali mending kukus biar tabur kelapa sawit tambah enjoy ya,0,0,0,0,0,0
4298,iya kagum gp sepe i jokowi dukung ai,0,0,0,0,0,0
4299,bah                 h wv,0,0,0,0,0,0
4300,dukung jokowi ainya,0,0,0,0,0,0
4301,ah ya gus dur almarhum biar nih ai nyungsep,1,0,1,0,0,0
4302,puasa batas lapar haus,0,0,0,0,0,0
4303,amin,0,0,0,0,0,0
4304,paling dibully nih emak kangen baju habibie almarhum beliau presiden selesai jabat nikmat hidup cawe urus negara,1,0,1,0,0,0
4305,lo anggota partai adil sejahtera caci maki perintah tutup perut kempes tah bantu langsung tunai pulkam urus kebun jakarta induk siswa warga nih,1,1,0,0,0,0
4306,joss                 cu ao is,0,0,0,0,0,0
4307,kemarin baby banget salah pic favorit,0,0,0,0,0,0
4309,tau vaksin nusantara covid akibat kering pundi rupiah metode cuci otak awan derita strok,1,0,1,0,0,0
4310,pagi ayammm,0,0,0,0,0,0
4311,pagi bang jimmy                 uw i,0,0,0,0,0,0
4312,vg,0,0,0,0,0,0
4313,pagi indonesia                 am c,0,0,0,0,0,0
4314,anakkolong vaksin nusantara hilang wabah mata mafia,0,0,0,0,0,0
4315,kintilll organisasi jenis majelis ulama indonesia layak panggung perintah pecat dokter awan bukti betapa organisasi,0,0,0,0,0,0
4316,coba minum air panas plus paracetamol mam paksa,0,0,0,0,0,0
4317,ganjarpranowo ajengmakmur pekaklonto ayu alhamdulillah terima kasih wak emil senang banget salah kagum ganjar moga rezeki wak emil be ambah barakat amin sehat winner congratz ya semangat                 cerdas spiritual,0,0,0,0,0,0
4318,tuju mbak mita bela rekan                 vn,0,0,0,0,0,0
4319,bela dokter                 yl,0,0,0,0,0,0
4320,oh bagi alam mbak,1,1,0,0,0,0
4321,amin beliau lawan mafia jahat hancur karirnya vaksin nusantara metode cuci otak derita strok akibat mafia gulung tikar,1,0,1,0,0,0
4322,baca,0,0,0,0,0,0
4323,harap periode                 hz,0,0,0,0,0,0
4324,patah sayap hancur kaki madam semangat terus garam dunia abdi dokter awan tuhan yesus kati amin                 office boy p,1,1,0,0,0,0
4325,amin moga lancar mudah sehat sukses mama semangaattt,0,0,0,0,0,0
4326,monsterhiphoop jadi monsta ajak main gaple mulu bang ndrews,0,0,0,0,0,0
4327,turun ana lo,1,1,0,0,0,0
4328,monsterhiphoop oh iya kiranti monsta,0,0,0,0,0,0
4329,gue demam minum sembuh tau tau cocok panas galau                 mb,0,0,0,0,0,0
4330,indonesia pimpin aki ogah jokowi jabat,1,1,0,0,0,0
4331,tantrum nih warga kadrun tau jokowi turun ganti,1,1,0,0,0,0
4332,galau mulu air asem jawa panas,0,0,0,0,0,0
4333,terima kasih groot                 b,0,0,0,0,0,0
4334,puasa niat takut lihat warung makan buka,0,0,0,0,0,0
4335,monsta monsterhiphoop,0,0,0,0,0,0
4336,ganjarpranowo api ganjar boleee salah kagum beliau                 an,0,0,0,0,0,0
4337,mudik libat orang banding moto gp batas maksimal k mudik ajang silaturahmi orang tua risiko papar orang tua                 hb,0,0,0,0,0,0
4338,selamat pagi bang wanta adem,0,0,0,0,0,0
4339,tindak sepe i tunggu menteri dagang bikin susah ibuk rumah tangga kemarin migor hilang,0,0,0,0,0,0
4341,sydney innalilahi wa inna ilaihi raji uji nasional dukacita tinggal istri bang sydney,0,0,0,0,0,0
4342,patung tri i letak kampung bal air hitam lampung barat patung gambar wajah dewa dewa dewa krisna dewa happy pekan nusantara,0,0,0,0,0,0
4343,takut c,0,0,0,0,0,0
4344,judahlion sekak ster,0,0,0,0,0,0
4345,coba opini monsta monsterhiphoop,1,1,0,0,0,0
4346,negara milik bayar,1,0,1,0,0,0
4347,sila twit rakyat,1,0,1,0,0,0
4348,yesss bukti gue                 k vq,0,0,0,0,0,0
4349,keren henti operasi layan kakak cibatu jaka a resmi ada tiket k kakak pandang alam khas parahyangan nikmat ssstt chaplin cibatu lo,0,0,0,0,0,0
4350,si,0,0,0,0,0,0
4351,biar mati cicil orang kayak                 p u hz,1,1,0,0,0,0
4352,lhaa mellow pawang mbaaakkk leonita lestari,0,0,0,0,0,0
4353,mam siang monsta,0,0,0,0,0,0
4354,cebong lawan,1,0,1,0,0,0
4355,meme asyik                 hq,0,0,0,0,0,0
4356,memenya,0,0,0,0,0,0
4357,berani cewek kampung awas minta maaf aku khilaf plus materai ceban,0,0,0,0,0,0
4358,santorinissun mustahil gp hitung,0,0,0,0,0,0
4359,santorinissun jual kerja b doang,0,0,0,0,0,0
4360,santorinissun bang                 qe,0,0,0,0,0,0
4361,didu welcome to massszeeehhh                 ge if,0,0,0,0,0,0
4362,senang iya bos,0,0,0,0,0,0
4363,amin siang mbak sinta                 ik,0,0,0,0,0,0
4364,enak,0,0,0,0,0,0
4365,sinaga orang kristen muka makan babi anjing makan babi anjing muka jeleeee ya laku                 si,1,1,0,1,0,0
4366,oh kader ai komen ya ketua ainya tindak tegur apa ainya yodah tenggelam ainya susah orang,0,0,0,0,0,0
4367,santorinissun golkar,0,0,0,0,0,0
4368,dukung jokowi ai cmiww,1,0,1,0,0,0
4369,namakoen iya                 v i kr oe,0,0,0,0,0,0
4370,tendang jawa timur tea maaf sepe i janji ulang                 bf,0,0,0,0,0,0
4371,tinggal tunggu ai gabung demokrat ambang batas cmiww,0,0,0,0,0,0
4373,namakoen iya,0,0,0,0,0,0
4374,namakoen iya pilih presiden tetap tanggal februari sila makan hoaks ikut asumsi                 ubeuhvaisj,0,0,0,0,0,0
4375,peluang pilih ganjar calon ai buka pilih orang ai simpel                 dho,0,0,0,0,0,0
4376,apa,0,0,0,0,0,0
4377,maksud,0,0,0,0,0,0
4378,ntb pribadi dukung orang maju daerah radikalisme apa putra daerah paham,0,0,0,0,0,0
4379,mau kasih tau beliau jabat gubernur,1,1,0,0,0,0
4380,tuju lihat video orang beliau tonton moto gp beliau pindah kursi vvip beliau tolak pilih kursi,0,0,0,0,0,0
4381,k,0,0,0,0,0,0
4382,tuju,0,0,0,0,0,0
4383,iya harap beliau salah menteri nawacita,0,0,0,0,0,0
4384,humble,0,0,0,0,0,0
4385,leonita lestari cubit                 qw,0,0,0,0,0,0
4386,monsterhiphoop bingung euy cintaahhh,0,0,0,0,0,0
4387,monsterhiphoop tani akrab just halo,0,0,0,0,0,0
4388,iya,0,0,0,0,0,0
4389,frankz nih sianggg                 h r,1,1,0,0,0,0
4390,monsterhiphoop nya untung tengah main media sosial ketemu monsta a gawat,0,0,0,0,0,0
4391,monsterhiphoop otak khilafah,1,0,1,1,0,0
4392,ajar dimedsos                 b,0,0,0,0,0,0
4393,mas diet rancang mbak ayunda wisuda kebaya merah tea kebaya kutu pakai rancang beliau,0,0,0,0,0,0
4394,bos mana                 qr fan page,0,0,0,0,0,0
4395,mbak kanya selamat pagi puasa lancar                 cd,0,0,0,0,0,0
4396,roy sukro,0,0,0,0,0,0
4397,baby alien bunyi,0,0,0,0,0,0
4398,orang papar aura gelap,0,0,0,0,0,0
4399,lengkap dus mie ya,0,0,0,0,0,0
4400,mbak nita                 c,0,0,0,0,0,0
4401,weh sehat mbak nuning ya buah annya banyaaakkk selesai panen eh antre petik,0,0,0,0,0,0
4402,mam pakai nasi bakcang,0,0,0,0,0,0
4404,pagiii,0,0,0,0,0,0
4405,sugeng enjang bang,0,0,0,0,0,0
4406,pagiii bos                 tg,0,0,0,0,0,0
4407,pagi                 lf o,0,0,0,0,0,0
4408,iya adem lini pagiiii                 f,0,0,0,0,0,0
4409,mbak lina selamat pagi ultahnya kemarin,0,0,0,0,0,0
4410,atuh mbak maudy pagiii bos                 iya r,1,1,0,0,0,0
4411,selamat enjang mbak nuning iya adem lini konde indah rambut mbak maudy lo make up keren ya,0,0,0,0,0,0
4412,see ne bawa kenang indah negeri titip salam warga ya                 si,0,0,0,0,0,0
4413,selamat pagi                 fm p,0,0,0,0,0,0
4415,cantiiikkk cerdas cepat medan monstaaaaaa monsterhiphoop pacar cewek kayak                 zqy,1,1,0,0,0,0
4416,moga lekas pulih ya bang marquez ramai,0,0,0,0,0,0
4417,opung low back pain kaleng                 ac ya,1,1,0,0,0,0
4418,adik amin rumah mbak yanti,0,0,0,0,0,0
4419,horeee ulang selamat ulang mbak lina umur sehat sukses amin                 mp,0,0,0,0,0,0
4420,takanakagami eh sembarang salah satu nenek mbak warga jepang kacang enak                 si z,0,0,0,0,0,0
4421,kali coba rebus jamin hitam kakak oke kasih tau deh rahasia,0,0,0,0,0,0
4422,v,0,0,0,0,0,0
4423,bang marquez otak akibat kemarin doa moga lekas sembuh ya                 x,0,0,0,0,0,0
4424,takanakagami tinggal nih kendi maling khas lombok banget,1,0,1,0,0,0
4425,kang ya                 je,0,0,0,0,0,0
4426,senyum ya,0,0,0,0,0,0
4427,maaf bilang khilaf,0,0,0,0,0,0
4429,tindak spontan bloin sepe i minta maaf                 hplreba zi,0,0,0,0,0,0
4430,mbak ganti teman aji plus suppo keluarga,0,0,0,0,0,0
4431,na rj,0,0,0,0,0,0
4432,korban maaf doang anggap selesai sepe i                 hplreba zi,0,0,0,0,0,0
4433,mbak rara kejawen beda server,0,0,0,0,0,0
4434,terima kasih bang moga bawa kesan indah negeri bawa khas indonesia sepe i bang marquez,0,0,0,0,0,0
4435,beda server gobblokkk,0,0,0,0,0,0
4436,sepe inya lagu deh,0,0,0,0,0,0
4437,hallooo cleo mochi,0,0,0,0,0,0
4438,pas                 a a,0,0,0,0,0,0
4439,minum nya es kacang hijau,0,0,0,0,0,0
4440,b,0,0,0,0,0,0
4442,pawang jenggot cingkrang                 p,0,0,0,0,0,0
4443,bunuh pulici sakit hati anggota pulici tembak anggota front bela islam km bebas,1,1,0,0,0,0
4444,bunuh pulici sakit hati pulici tembak anggota front bela islam km bebas bapak,1,0,1,0,0,0
4445,mak kadrun                 si v,0,0,0,0,0,0
4446,emak gue                 i eh,0,0,0,0,0,0
4447,cari google lagu                 kd,0,0,0,0,0,0
4448,lagu enak monsta ya judul,0,0,0,0,0,0
4449,maaf ciduk nih sebab marquez jatuh                 r,0,0,0,0,0,0
4450,nampol,0,0,0,0,0,0
4451,bu sri mulyani,0,0,0,0,0,0
4452,mang ya,0,0,0,0,0,0
4453,pawang bayar utang negara selamat pagi indonesia,1,0,1,0,0,0
4454,amin,0,0,0,0,0,0
4455,lelaki payung usaha lindung negeri sehat jokowi,0,0,0,0,0,0
4457,monsterhiphoop moga cinta jodoh anuuu monsta mak mak,0,0,0,0,0,0
4458,jinnonik senang iya panas,0,0,0,0,0,0
4459,pangapunten mbak gambar guyon daerah milik ahli urut tulang sepe i jampang cimande lombok milik ahli                 qv ly,1,1,0,0,0,0
4460,monsterhiphoop jodoh te unda,0,0,0,0,0,0
4461,jinnonik calon nenek an,0,0,0,0,0,0
4462,jinnonik beda ya beda pokok lo mesti berkat nikah gereja,0,0,0,0,0,0
4463,monsterhiphoop bah                 fm l,0,0,0,0,0,0
4464,jinnonik gue doa cepat married biar baby,0,0,0,0,0,0
4465,jinnonik ah harap mbak santi ketemu cowok bikin nyaman married jomlo takdir single pilih                 p b,0,0,0,0,0,0
4466,jinnonik kecuali married ya aamiinkan gin uwitnya                 z,0,0,0,0,0,0
4467,bicara tolong jelas,0,0,0,0,0,0
4468,bicara massszeeehhh coba inti biar,0,0,0,0,0,0
4469,gue sayang umat                 c,0,0,0,0,0,0
4470,just for fun,0,0,0,0,0,0
4471,salah betah kadrun nge i,0,0,0,0,0,0
4472,cocok an pilih dokter pilih,0,0,0,0,0,0
4473,tanggung malu ngedoain hujan eh reda ngedoain gagal sukses kompor tonton bulu,0,0,0,0,0,0
4474,adijaya junimendo mbak pingitz biar buya salah sujud dengar suara imam tinggal kadrun pintar ambil ajar gandeng mbak pingitz pergi be iga noleh mending obrol be iga                 i,0,0,0,0,0,0
4475,adijaya ya bikin hati,0,0,0,0,0,0
4476,tau intip ya,0,0,0,0,0,0
4477,santuyyy laku indonesia                 i,0,0,0,0,0,0
4478,uwit beli uwit kukus tumis panggang bakar hidup ribet,1,1,0,0,0,0
4479,adijaya mbak juni tau kadrun cewek bening cari perhati banget obrol mandalika bicara migor tinggal kadrun mutu kibas poni gandeng mbak juni pergi dua noleh belakang                 aa,1,0,1,0,0,0
4480,on,0,0,0,0,0,0
4481,ya                 wylmd rvpc,0,0,0,0,0,0
4482,mbak rara mbak jago pawang mandalika kemarin gin lo tampil kemarin,0,0,0,0,0,0
4483,yess,0,0,0,0,0,0
4484,nyonya pawang kadrun pagiii,0,0,0,0,0,0
4485,mbak mita guyon doang aku hebat ahli tradisional sembuh tulang sepe i cimande jampang dayak lombok                 c,1,1,0,0,0,0
4486,pawang buaya pawang hujan tradisi unik indonesia hayo nyambut kerja gede jasa pawang hujan selamat pagi,0,0,0,0,0,0
4487,asooyy ritual henti hujan                 wylmd rvpc,0,0,0,0,0,0
4488,b,0,0,0,0,0,0
4489,uraaaaaa                 t,0,0,0,0,0,0
4490,kinjengkolenka bintang                 v,0,0,0,0,0,0
4491,monstaaaaaa monsterhiphoop ya,0,0,0,0,0,0
4492,kinjengkolenka,0,0,0,0,0,0
4493,massszeeehhh layak dipe imbang bayar                 si iya,0,0,0,0,0,0
4494,ya hulul halal,0,0,0,0,0,0
4495,coba minyak                 fe,0,0,0,0,0,0
4496,kesal ajak tonton moto gp raja kadrun,0,0,0,0,0,0
4497,bonus                 b,0,0,0,0,0,0
4498,kang urut massszeeehhh                 l a,1,1,0,0,0,0
4499,wajib nih,0,0,0,0,0,0
4500,habis mandalika cerita pawang hujan kang urut dunia pakai minyak minyak urut khas lombok                 sv ww,0,0,0,0,0,0
4501,timpa                 t yq i,0,0,0,0,0,0
4502,ai anggota nya rajin panca roy suryo                 fr rm,1,0,1,0,0,0
4503,kadrun diam,0,0,0,0,0,0
4504,dauph doa kabul,1,1,0,0,0,0
4505,ya biar bangga bangsa indonesia,0,0,0,0,0,0
4506,bangga adat istiadat indonesia,1,1,0,0,0,0
4507,kidal bonus bos                 k,0,0,0,0,0,0
4508,santorinissun mabuk agama nih kerja mbak rara aksi roro istiati istiati sirkuit mandalika                 k,0,0,0,0,0,0
4509,pawang hujan seram nya ya baju beda ritual mohon maha,0,0,0,0,0,0
4510,santorinissun yess                 x,0,0,0,0,0,0
4511,hem mbak rara undang event internasional formula e kadrun                 uo gue,0,0,0,0,0,0
4512,go internasional aku,0,0,0,0,0,0
4513,kaum paham ajar agama,1,0,1,1,0,0
4514,presiden,0,0,0,0,0,0
4515,iya                 if b,0,0,0,0,0,0
4516,maksud,0,0,0,0,0,0
4517,maksud,0,0,0,0,0,0
4518,a good paham ajar agama menge i agama patuh dise ai akal pikir,0,0,0,0,0,0
4519,enak mbak nuning mbok ya tawar tamu main moto gp,0,0,0,0,0,0
4520,kaum mabuk paham agama,1,1,0,0,0,0
4521,agama harap anak pasang meni iman agama,0,0,0,0,0,0
4522,hallooo jarang sapa nama,0,0,0,0,0,0
4523,indonesia agam adat istiadat agama                 qk,0,0,0,0,0,0
4524,arifinpribadi coba arifinpribadi narasi ikut teladan nabi                 c,1,1,0,0,0,0
4525,mandalika waahh jaaaattt pekan ajak keluarga,0,0,0,0,0,0
4526,siaaangg waahh jokowi iriana moto gp santai banget baju                 j,0,0,0,0,0,0
4527,sapa ya gembok tah lihat eh,0,0,0,0,0,0
4528,jokowi indonesia,1,1,0,0,0,0
4529,maksud,0,0,0,0,0,0
4530,fucckkk pikir sih,1,1,0,0,0,0
4531,anakkolong ha                 oe,0,0,0,0,0,0
4532,semangaattt                 a fd,0,0,0,0,0,0
4533,happy pekan beda gaya beda zaman,0,0,0,0,0,0
4534,pagiiii buah ya happy pekan mbak luke                 z kh,1,0,1,0,0,0
4535,meni komentar restu biar malaikat catat amal ibadah biar tuhan tentu                 qd,0,0,0,0,0,0
4536,monsterhiphoop pintar monsta,0,0,0,0,0,0
4537,monsterhiphoop nakal banget ya,0,0,0,0,0,0
4538,jinnonik difollow nih,1,1,0,0,0,0
4539,acieee om fadli zon eta terang                 o,1,1,0,0,0,0
4540,cerdas bryno,0,0,0,0,0,0
4541,kakakeyo seroja merah eh mantan ketua organisasi siswa,0,0,0,0,0,0
4542,monstaaaaaa pulang yuuukkk,0,0,0,0,0,0
4543,pagi indonesia,0,0,0,0,0,0
4544,dedek sena tumbuh rambut                 v el,0,0,0,0,0,0
4545,marco,0,0,0,0,0,0
4546,aditcm bilan ibune neng alah bicara mulu,0,0,0,0,0,0
4547,aditcm bilan ibune neng sila selamat belanja ya                 ck,1,1,0,0,0,0
4548,bah,0,0,0,0,0,0
4549,selamat pagi,0,0,0,0,0,0
4550,monsta,0,0,0,0,0,0
4551,santorinissun nu,0,0,0,0,0,0
4552,bang punten sepe inya banget online ya hafal avanya tren operasi plastik sehat tah,0,0,0,0,0,0
4553,happy,0,0,0,0,0,0
4554,kereta api langsung tangan dingin beliau                 qr,0,0,0,0,0,0
4555,coba halal sepe i majelis ulama indonesia                 o,0,0,0,0,0,0
4556,gaaassss,0,0,0,0,0,0
4557,mam kulkas barus ya ngabisin stok barang label halal zaman eh,0,0,0,0,0,0
4558,aditcm bilan ibune neng beli online,0,0,0,0,0,0
4559,sepe i                 j,0,0,0,0,0,0
4560,wakil balap indonesia,0,0,0,0,0,0
4561,yess,0,0,0,0,0,0
4562,pilih jokowi kali,0,0,0,0,0,0
4563,mana ya nyambut,0,0,0,0,0,0
4564,moto gp bos bal bangkit lo tinggal ferry nyebrang sw,0,0,0,0,0,0
4565,nakula ngehekk kadrun teriak nimbun                 i,0,0,0,0,0,0
4566,qz,0,0,0,0,0,0
4567,santorinissun                 ow,0,0,0,0,0,0
4568,hal                 pb j,0,0,0,0,0,0
4569,pf,0,0,0,0,0,0
4570,jokowi                 h,1,1,0,0,0,0
4571,jokowi psi langsung bayang makan damping asi,0,0,0,0,0,0
4572,ibune neng link,0,0,0,0,0,0
4573,novel,1,1,0,0,0,0
4574,ibune neng hadeehhh tolong deh                 ba,0,0,0,0,0,0
4575,ibune neng eh mata bagus belah,0,0,0,0,0,0
4576,goreng juga kadrun mesti februari populer valentine ya pakai baju merah muda haraaammm                 gede el qbob,0,0,0,0,0,0
4577,pilih tunda,0,0,0,0,0,0
4578,halo mandalika selamat pagi,0,0,0,0,0,0
4579,tenda rencana bencana,0,0,0,0,0,0
4580,jokowi tenda jokowi pakai gempa poso tenda rencana bencana beda banget ya,0,0,0,0,0,0
4581,tuju just for fun                 f,0,0,0,0,0,0
4582,aman protes kadrun,0,0,0,0,0,0
4583,baby sena pic kanan bayang nya dedek sena saking gemas,0,0,0,0,0,0
4584,bilan ibune neng,0,0,0,0,0,0
4585,mana ya iya jokowi camping                 z,0,0,0,0,0,0
4586,ibune neng tenda inventaris setpres gempa poso pakai                 a,0,0,0,0,0,0
4587,chou oh iya dukung duduk damping tanda akrab bera i mesti orang                 i,1,1,0,0,0,0
4588,diisengin netizens langsung luas sepe iga rencana,0,0,0,0,0,0
4589,kayak ya tenda presiden o t wkwk,0,0,0,0,0,0
4590,presiden heru tenda tenda inventaris setpres pakai beli gempa bumi poso fasilitas tenda istimewa ac                 oi,0,0,0,0,0,0
4591,sarung ya main mam jagung bakar                 dv,1,1,0,0,0,0
4592,juta                 t,0,0,0,0,0,0
4593,oh iya full ac,1,1,0,0,0,0
4594,garuda pancasila gentong bangga saksi sejarah bentuk kota nusantara kadrun suka onta gentong,1,1,0,0,0,0
4595,kangen kerja ahok ahok sirkuit mandalika jelang moto gp                 p,1,1,0,0,0,1
4596,krisnaalka jokowi amin,0,0,0,0,0,0
4597,kadrun dulunya tanah sengketa bawa panas mulu                 z hu,0,0,0,0,0,0
4598,krisnaalka jokowi amin,0,0,0,0,0,0
4600,rambut bunga biar harum,0,0,0,0,0,0
4601,krisnaalka jokowi amin,0,0,0,0,0,0
4602,waahh minyak kelapa ya oil,0,0,0,0,0,0
4603,krisnaalka jokowi amin,0,0,0,0,0,0
4604,gubernur bawa tanah air sumber baik restu simbol titip warga satu bangsa agam                 ap j,0,0,0,0,0,0
4605,amin,0,0,0,0,0,0
4606,pagi bos                 z ns ai,0,0,0,0,0,0
4607,iya sepe inya twitter,0,0,0,0,0,0
4608,selamat pagi bang edwin,0,0,0,0,0,0
4609,oh terima kasih tau,0,0,0,0,0,0
4610,mbak lina selamat pagi,0,0,0,0,0,0
4611,amin pagi,0,0,0,0,0,0
4612,santorinissun bang langsung nih tertawa mulu                 ln,1,1,0,0,0,0
4613,santorinissun bah                 bt,0,0,0,0,0,0
4614,sirik ajak camping,0,0,0,0,0,0
4615,oh,0,0,0,0,0,0
4617,anjing bicara,1,1,0,0,0,0
4618,sibuk nyambut kerja                 mj x,0,0,0,0,0,0
4619,ih geli banget lihat,0,0,0,0,0,0
4621,monsta pagi bikin melted tuing tuing tuing,0,0,0,0,0,0
4622,selamat pagi,0,0,0,0,0,0
4623,sarung,0,0,0,0,0,0
4624,rd wr knpiharis airlangga h ikan mini pakai hem gede kepala,0,0,0,0,0,0
4625,jokowi leonita lestari eg risma amin                 pqf js,0,0,0,0,0,0
4626,hayoooo bang request lagu                 l,0,0,0,0,0,0
4627,enak zaman jokowi                 vj,0,0,0,0,0,0
4628,tenda suka tenda jokowi,0,0,0,0,0,0
4629,nusantara satu tanah air provinsi titik nol kota nusantara satu tanah air satu indonesia                 j,1,0,1,1,0,0
4630,bawa orok ya,0,0,0,0,0,0
4631,politikus hati kayak cepat banget lihat susah orang,1,1,0,0,0,0
4632,budhe kocheng tahu,0,0,0,0,0,0
4633,santorinissun sodor,1,1,0,0,0,0
4634,gaaassss gemini lo pakai no bawa asa                 d,0,0,0,0,0,0
4635,tanah kubur atuh                 undang undang,0,0,0,0,0,0
4636,merinding lo makna                 dei tew,0,0,0,0,0,0
4637,resep zaman orang minum bir buat minum bir warna merah ya hangat badan parahyangan,1,1,0,0,0,0
4638,bir,1,1,0,0,0,0
4639,gubernur serah air tanah ambil propinsi pimpin air tanah propinsi satu presiden jokowi lambang satu satu indonesia                 dei tew,1,1,0,0,0,0
4640,pagi indonesia kemarin siang presiden jokowi be olak kalimantan timur kawasan titik nol ikn nusantara                 d,0,0,0,0,0,0
4641,ehe ehe,0,0,0,0,0,0
4642,mobil esemka orang ludah langit percik muka                 l,0,0,0,0,0,0
4643,kakakeyo monsterhiphoop sip balas twitnya,1,0,1,0,0,0
4644,meni riweuh halal komentar simpel mudah uwit ifikat halal masuk negara bikin bu smi senyum,0,0,0,0,0,0
4645,kakakeyo monsterhiphoop asli kilas twitnya nungul bohong,1,1,0,0,0,0
4646,kakakeyo monsterhiphoop mas,0,0,0,0,0,0
4647,kakakeyo monsterhiphoop gawat mbak nita mas twitnya langsung cemburu berat saing monsta kompor gasss                 gue,0,0,0,0,0,0
4648,kakakeyo monsterhiphoop mbaaakkk nita lagu monsta malam tembak mbak nita lo sih,0,0,0,0,0,0
4649,modal main rumah eh emen,0,0,0,0,0,0
4650,listy jaaaattt gue sama ya iya                 iya,0,0,0,0,0,0
4651,haaa izin monstaaaaaa monsterhiphoop komentar cewek mandiri sepe i mbak laku,0,0,0,0,0,0
4652,o lhooo tristan sembuh ya banget pipi,0,0,0,0,0,0
4653,beliau humble,0,0,0,0,0,0
4654,fakta,0,0,0,0,0,0
4655,pacualbino mohamma alyafziyah harga niat mbak alya orang sepe imu,0,0,0,0,0,0
4656,lucu monsta monsterhiphoop coba game bryno,0,0,0,0,0,0
4657,acieee monsta tembak mbak nita berat saing lo monsta akun puluh k cerdas dukung bikin mbak nita tertawa,0,0,0,0,0,0
4658,monstaaaaaa monsterhiphoop puding nih coklat kompor air panas,0,0,0,0,0,0
4660,o moga lekas sembuh tristan amin,0,0,0,0,0,0
4661,pajak pacualbino chipikapiki kaum bumi datar sabda sesuai ilmu,1,0,1,1,0,0
4662,pacualbino mohamma chipikapiki weiss milik sabda,0,0,0,0,0,0
4663,mohamma chipikapiki,0,0,0,0,0,0
4664,pacualbino mohamma alyafziyah tinggal terang ribet,0,0,0,0,0,0
4665,ajar,0,0,0,0,0,0
4666,mohamma alyafziyah komentar sepe i mbak tunggu orang cari google,1,1,0,0,0,0
4667,mohamma alyafziyah terang bera i agama islam agama rahmat lil al amin,0,0,0,0,0,0
4668,mohamma sayang dapat sepe i terang uji semester kesalahpahaman sepe i terima kasih mbak alyafziyah respect mbak,0,0,0,0,0,0
4669,sepe i be ambah ilmu menge i terima kasih mbak alya,0,0,0,0,0,0
4670,ha mas bikin hati,0,0,0,0,0,0
4671,mohamma chipikapiki baca tulis sempat mas uji semester timbul simpel,0,0,0,0,0,0
4672,chipikapiki mohamma kadang heran akun model sempat terang bukti islam rahmat lil al amin,0,0,0,0,0,0
4673,chipikapiki ulama ulama su islam,0,0,0,0,0,0
4674,anakkolong jeh mawar biru cintaahhh bayang mas doang berani bilang jeleeee bikin geger                 zt iya a,1,1,0,0,0,0
4675,mohamma chipikapiki muslim sila terang maksud beliau menge i,0,0,0,0,0,0
4676,chipikapiki sijempol mesti gue murid somad eta terang                 l,0,0,0,0,0,0
4677,mohamma chipikapiki mohamma aku ulama somad somad nge i murid durhaka,0,0,0,0,0,0
4678,chipikapiki sijempol bukti linknya main pintar,0,0,0,0,0,0
4679,moga lekas tindak perintah rakyat tanggung akibat puasa sebentar,1,1,0,0,0,0
4680,hias lirik pagi nusantara,0,0,0,0,0,0
