,Tweet,HS,HS_Individual,HS_Group,HS_Religion,HS_Race,HS_Gender
1649,kemarin bu retno bu smi pesona                 ab iya,0,0,0,0,0,0
1650,ayam hitam ayam khas indonesia ayam pakai ayam poni ayam kampus avanya ya                 l a j,0,0,0,0,0,0
1652,yam ava ya pangling gede,0,0,0,0,0,0
1653,jokowi salah fokus bu iriana gaul banget lihat sepatu                 a p,0,0,0,0,0,0
1654,mesti pasang cctv mulut tetangga jamin aman hilang,0,0,0,0,0,0
1655,jokowi ramlirizal singkat padat                 jo,1,1,0,0,0,0
1656,listyosigitp divhumas polisi republik indonesia wajah pulici camping                 wt lini e,0,0,0,0,0,0
1657,ramlirizal hem menteri uang sri mulyani potensi indonesia alami,0,0,0,0,0,0
1658,mbak mawar selamat pagi                 gue em,0,0,0,0,0,0
1659,anak,0,0,0,0,0,0
1660,santorinissun pagiii                 jz si,0,0,0,0,0,0
1661,pesan basuki mbak via vallen hari nikah                 e x,0,0,0,0,0,0
1662,basuki ganteng banget yess beliau erick thohir saksi nikah mbak via vallen mbak via moga samawa cepat momong rukun bahagia amin                 j,0,0,0,0,0,0
1663,halus jokowi fokus selesai tugas oktober,0,0,0,0,0,0
1664,oktober habis,0,0,0,0,0,0
1666,selamat pagi indonesia,0,0,0,0,0,0
1667,pandang ambil ancang ancang lari gesit pulih cepat bangkit kuat indonesia semangaattt we are rock,0,0,0,0,0,0
1668,yess pagi                 b v,0,0,0,0,0,0
1669,he he he pagi mbak sinta                 do,0,0,0,0,0,0
1670,nies ajak presiden jokowi resmi gedung sarinah renovasi,0,0,0,0,0,0
1671,bu smi menteri kaleng                 adil negeri,1,1,0,0,0,0
1673,ah coblos calon presiden partai adil sejahtera                 si,0,0,0,0,0,0
1674,bahagia cipta ingat kawan rela jatuh ibu susah payah ajar diri semangaattt hug for                 i,0,0,0,0,0,0
1675,santuyyy ngupi ngamati februari gerak tpu pilih calon presiden calon wakil presiden lanjut kerja jokowi                 z,0,0,0,0,0,0
1676,maaf karma kali warga tag jelas bantu pulici diam viral aib selesai                 m,0,0,0,0,0,0
1677,titip teteh,0,0,0,0,0,0
1678,alhamdulillah moga dia kerja,0,0,0,0,0,0
1681,peluk kakak oke,0,0,0,0,0,0
1682,kakakeyo mbak maaf salah kakak oke,0,0,0,0,0,0
1683,ayamsegar kretek delman ya gadis kretek bera i gadis delman duduk samping kretek istimewa jalan tik tik tik tik tik tik tik tik tik kuda,0,0,0,0,0,0
1684,amin iman                 ku,0,0,0,0,0,0
1685,pagi dek sena lesung pipi ya gemas                 wq,0,0,0,0,0,0
1686,adi punten kretek rokok nih film judul gadis kretek                 z,0,0,0,0,0,0
1687,si,0,0,0,0,0,0
1688,semangaattt                 ek,0,0,0,0,0,0
1689,pimpin pimpin zaman periode terus pimpin rasa kerja saran kritik indonesia                 r,0,0,0,0,0,0
1690,atuh                 gs,1,1,0,0,0,0
1691,iya                 v,0,0,0,0,0,0
1692,santorinissun plus                 wa am,0,0,0,0,0,0
1693,beuh                 gue,0,0,0,0,0,0
1694,aisocmed jokowi susipudjiastuti mbak malu deh bu mega perempuan presiden salah,1,1,0,0,0,0
1695,aisocmed jokowi susipudjiastuti ngadi tanggal februari pilih presiden sila up jago moga ai dukung,0,0,0,0,0,0
1696,tjapoenglaut mbak nuning temu ditwitter,0,0,0,0,0,0
1697,o,0,0,0,0,0,0
1698,lihat as baca mbak dian film mbak dian utama,0,0,0,0,0,0
1699,santorinissun menteri kabinet pe kerja pikir motivasi jokowi pilih orang orang kerja,0,0,0,0,0,0
1700,kadang iseng santuy capt akun akun suka gantung suasana hati                 gu,0,0,0,0,0,0
1701,pulici tembak cctv nya,0,0,0,0,0,0
1703,dian,0,0,0,0,0,0
1704,adem lini,0,0,0,0,0,0
1705,gigi kuning ya mbok copot,0,0,0,0,0,0
1706,harap ikan buntal                 j,0,0,0,0,0,0
1707,ghurem panjianom pedeipeh jokowi anggota ai presiden bu mega tambah menteri menteri pedeipeh korupsi hukum jokowi beda presiden anggota ai,0,0,0,0,0,0
1708,ghurem panjianom ai kandidat presiden tau motivasi beliau kader ai,0,0,0,0,0,0
1709,harap jabat nyinyir habis an jabat aldo perhati donasi,1,1,0,0,0,0
1710,ghurem panjianom amin harap moga beliau maju gubernur daftar anggota ai moga bu mega kenan mempe imbang,0,0,0,0,0,0
1711,ganti agus harimurti yudhoyono tau guna,1,0,1,0,0,0
1712,amin,0,0,0,0,0,0
1713,mbak esteh langsung memenya                 jh,1,1,0,0,0,0
1714,ulang tah congratz,0,0,0,0,0,0
1715,suasana hati booster pagi mbak masak,0,0,0,0,0,0
1716,mbak sih mending susilo bambang yudhoyono,1,1,0,0,0,0
1717,mpraldo hidup sih aldo anjing ya,0,0,0,0,0,0
1718,amin halo dedek,0,0,0,0,0,0
1719,pagi istirahat tah                 a,0,0,0,0,0,0
1720,yess,0,0,0,0,0,0
1721,galak dimedsos pas ketemu,0,0,0,0,0,0
1722,ah ganjar asiknya andika biar om prabowo menkopolhukam ganti posisi malas teman buntal                 ah k,0,0,0,0,0,0
1723,adies terima kasih ayammmm hatur terima kasih kang adies                 o,0,0,0,0,0,0
1724,adies mama nyanyi lagu ulang,0,0,0,0,0,0
1725,panjianom presiden calon gubernur basuki halus tolak kerja jempol                 ti,0,0,0,0,0,0
1726,diresuffle jokowi                 po sz,0,0,0,0,0,0
1727,hem,0,0,0,0,0,0
1728,dukung perintah cap kafeeerrr,0,0,0,0,0,0
1729,cundang indonesia sepe i presiden jokowi bese a kabinet usaha jadi indonesia salah jangka pendek modal jangka bendung siang negara satu republik indonesia                 gq,0,0,0,0,0,0
1730,ritafauzh asli google tau by the way koperasi ulang lo,0,0,0,0,0,0
1731,ritafauzh bunda ulang bareng atuh moga umur bahagia cantik happy amin hip hip uraaa,0,0,0,0,0,0
1732,j,0,0,0,0,0,0
1733,pulici be indak                 tm,0,0,0,0,0,0
1734,ditwitter ya ajar bahasa jawa campur kupi,0,0,0,0,0,0
1735,ya,0,0,0,0,0,0
1737,pagi kang adies nice but boleee pagi request lagu ya lagu kumpul bocah hatur terima kasih,0,0,0,0,0,0
1738,langsung mantan pindah on,0,0,0,0,0,0
1739,r v,0,0,0,0,0,0
1740,hegie ya,0,0,0,0,0,0
1741,aniesbaswedan potong hewan kurban sepe i tindak keras tuju,0,0,0,0,0,0
1742,dapat,0,0,0,0,0,0
1743,raja aniesbaswedan sepe i lo potong hewan kurban sepe i gera hewan sakit                 o,0,0,0,0,0,0
1744,benar temu jalan,0,0,0,0,0,0
1745,bentuk bela peduli terima kasih saudara,0,0,0,0,0,0
1746,nya banget,0,0,0,0,0,0
1747,pagiii cute banget be happy ya,0,0,0,0,0,0
1748,teman akhlak bela bang diisengin main hem bikin te arik bu sus presiden mode on,1,1,0,0,0,0
1749,ahayyy tunggu ah from this to this semangaattt,0,0,0,0,0,0
1750,iya dosa mesti biar sakit edar ditemlen sapi nya,0,0,0,0,0,0
1751,santorinissun sepe inya bicara selesai materai,0,0,0,0,0,0
1752,keren ya mbak sapa suruh ambil sendok sembarang sendok cuci pakai pasir rasa sedih,0,0,0,0,0,0
1753,gerak cepat sendok,0,0,0,0,0,0
1754,e nl e,0,0,0,0,0,0
1755,hegie acieee ambek garing kayak kerupuk,0,0,0,0,0,0
1756,hegie bilang gue peduli                 iya,0,0,0,0,0,0
1757,hitung mundur                 korban galau berat,1,1,0,0,0,0
1759,bah bilang mbak cantik,0,0,0,0,0,0
1760,cantik,0,0,0,0,0,0
1761,hegie,0,0,0,0,0,0
1762,anakkolong bungs agus harimurti yudhoyono kelas harga daging pas jelang aki zaman tau harga jelang pic sambung lucu                 sb vb c,0,0,0,0,0,0
1763,heran jokowi utang presiden                 ce,0,0,0,0,0,0
1764,ice cream,0,0,0,0,0,0
1765,bungs agus harimurti yudhoyono saing gibran adeknya gibran kaesang level agus harimurti yudhoyono presiden raup muka deh iler sih,1,0,1,0,0,0
1766,cupidlucky rita wati bandung bos monggo,0,0,0,0,0,0
1767,fan page,0,0,0,0,0,0
1768,selamat misa mas selamat garam dunia bawa kabar bahagia damai,0,0,0,0,0,0
1769,o assalamualaikum shalom aleichem saudara manusia,0,0,0,0,0,0
1770,weh lihat kilas jadi mbak puspa ya usil mode on,0,0,0,0,0,0
1771,rizieqdivist khofifahip bu ibadah haji wakil plt tah emil kait,0,0,0,0,0,0
1772,selamat misa capt selamat sukacita sama damai hati bumi tuhan yesus kati amin,0,0,0,0,0,0
1773,teh nunung selamat idul adha mohon maaf lahir batin                 l,0,0,0,0,0,0
1774,iya happy,0,0,0,0,0,0
1775,selamat pagi pagi ya salat idulfitri nya semarang,0,0,0,0,0,0
1776,amin,0,0,0,0,0,0
1777,mbak yanti meni pangling cantiikkk selamat raya idul adha mohon maaf lahir batin,0,0,0,0,0,0
1778,selamat pagi mbak nuning selamat misa,0,0,0,0,0,0
1779,tukang makan sambung bodoh lo jis sirkuit idul adha oh turut bangga                 r,1,1,0,0,0,0
1780,mal aidzin faidzin bude mohon maaf lahir batin,0,0,0,0,0,0
1781,neng sofyy november cmiww bu lurah ulang bintang,0,0,0,0,0,0
1782,puspaswarna johnhendrik rip dukacita dalam dalam,0,0,0,0,0,0
1783,istimewa selamat ulang bos umur sehat kuat amin,0,0,0,0,0,0
1784,ijo selamat kurban bu lurah,1,1,0,0,0,0
1785,neng sofyy putri bu lurah ulang,1,1,0,0,0,0
1787,mbak selamat idul adha mohon maaf lahir batin                 r facebook,0,0,0,0,0,0
1788,selamat misa om dicky,0,0,0,0,0,0
1789,gubernur mana ya ada jis,0,0,0,0,0,0
1790,terima kasih bonbon insya allah salam papa                 gue,0,0,0,0,0,0
1791,malam penuh lantun doa beda server hari nikmat indah iman hati selamat raya idul adha umat muslim selamat misa umat kristiani                 v,0,0,0,0,0,0
1792,terima kasih mbak angel selamat misa,0,0,0,0,0,0
1793,gocek untung tetangga tau habis,0,0,0,0,0,0
1794,request lagu bonbon bolee ya lagu suka papa,0,0,0,0,0,0
1795,punten kang abdi lepat sanes kurban teh salat idulfitri salat eta potong sanes kurban puasa selamat iedul adha,0,0,0,0,0,0
1796,buset jantan kambing akhlak selamat idul adha ya mbak maaf lahir batin,0,0,0,0,0,0
1797,pagi bonbon selamat raya idul adha,0,0,0,0,0,0
1798,amin terima kasih mbak nita selamat misa,0,0,0,0,0,0
1799,pilih pilih                 tir,0,0,0,0,0,0
1800,cewek hasil anak,0,0,0,0,0,0
1801,lihat gubernur daerah khusus ibukota,0,0,0,0,0,0
1802,rita wati mbak selamat misa izin latar gereja salat idulfitri selesai misa mampir rumah ajak bang kristen beli hindu koh om buddha mbak percaya ateis mam opor ayam ketupat,0,0,0,0,0,0
1803,cak an bicara jahat timpa anak mu saudara perempuan kait politik                 juta,0,0,0,0,0,0
1804,halo valco happy dreams,0,0,0,0,0,0
1805,anak polah kepradah,0,0,0,0,0,0
1806,selamat raya idul adha mbak maaf lahir batin,0,0,0,0,0,0
1807,amin semangaattt,0,0,0,0,0,0
1808,contoh ikan buntal gendut kopong racun tang koki ikan ubah santap koki pilih buntal racun                 lembar,0,0,0,0,0,0
1809,hegie dukung,0,0,0,0,0,0
1810,waiyak lihat ya mbak tunggu see masak opor by the way selamat raya idul adha maaf lahir batin                 sw,0,0,0,0,0,0
1811,islam benci orang cabul manfaat ilmu buat jahat nge i cak an jokowi kesana calon presiden calon wakil presiden kunjung musim kampanye,1,1,0,0,0,0
1812,marah marahiiinnn tendang                 x,0,0,0,0,0,0
1813,menteri negeri ri jokowi siap bu retno acara lancar sayang bu retno                 kre wx,0,0,0,0,0,0
1814,sekak panggung politik runtuh presiden jokowi bese a iriana rencana laksana salat iedul adha mesjid istiqlal jaka a minggu tanggal juli chaplin kumis tinggal                 iya,0,0,0,0,0,0
1815,simak,0,0,0,0,0,0
1816,bahasa awam mar,0,0,0,0,0,0
1817,alhamdulillah rencana sungguh indah,0,0,0,0,0,0
1818,punten ganggu vodka langsung vodka teh minum kayak,0,0,0,0,0,0
1819,terima kasih happy pekan mbak luke,0,0,0,0,0,0
1820,kritik bacot solusi capai capai tuju,0,0,0,0,0,0
1821,labbaik labbaik labbaik syarika laka labbaik wan nih mata laka syarika lak,1,1,0,0,0,0
1822,is is om,1,1,0,0,0,0
1823,main bera i tau telur puyuh burung sepe i dengar,0,0,0,0,0,0
1824,telur puyuh,0,0,0,0,0,0
1825,susipudjiastuti mbak mei have a nice day,0,0,0,0,0,0
1826,eh iya ketan hitam pisang bubur bubur pakai sendok ayo biar tahu sejarah bubur kampiun,0,0,0,0,0,0
1827,susipudjiastuti izin indonesia impor besar gandum ukraina rusia sederhana jokowi usaha negara lapar terigu langka,0,0,0,0,0,0
1828,bubur kampiun,0,0,0,0,0,0
1829,pagi mbak elly happy pekan,0,0,0,0,0,0
1830,ganti,1,0,1,0,0,0
1831,selamat pagi pekak whiskey                 a f,0,0,0,0,0,0
1832,pulang yuk monsta jitak lo,0,0,0,0,0,0
1833,na dirs maman nama beda server ibadah sesuai agama agama saudara,0,0,0,0,0,0
1834,susah bos kader ai pedeipeh ganjar mbak puan gerindra prabowo menteri ketua majelis ulama indonesia,1,0,1,0,0,0
1835,tumben lempeng minum cucu ya,0,0,0,0,0,0
1836,selamat pagi mbak astee bersay halo putri nyanyi lomba                 ep,1,0,1,0,0,0
1837,syukur atuh timur olok sirik tanda cewek kelas versi tara cowok,1,1,0,0,0,1
1838,viral baca thread sapa masuk akal susah jemput santri taat kiai pas berita kiai nu besok langsung ciduk pakai drama,1,0,1,0,0,0
1839,fashionable terima kasih pagi,0,0,0,0,0,0
1840,gula pasir,0,0,0,0,0,0
1841,selamat pagi mbak laksmee                 v,0,0,0,0,0,0
1842,juta suara plus keluarga santri tetangga saudara balon kunjung pesantren dukung kunjung dukung dise ai balas budi biar anak bebas beda,0,0,0,0,0,0
1843,jokowi ehe                 jp ct i,1,1,0,0,0,0
1844,cikgu komen,0,0,0,0,0,0
1845,tindak patut apresiasi salah presiden jokowi pilih beliau,0,0,0,0,0,0
1846,leonita lestari rian kota,0,0,0,0,0,0
1847,orang tua umur lupa percaya nasehat                 e e,0,0,0,0,0,0
1848,mantan indah sulit pindah on kucel bersih ahok gandeng usaha jerman bersih kualitas baik jaka a,0,0,0,0,0,0
1850,tanam citra jis anies                 o wq l,1,1,0,0,0,0
1851,rasa kerja,0,0,0,0,0,0
1852,ketan makan khas daerah sumbar enak mam rendang ketan,0,0,0,0,0,0
1853,amin sakit tah,0,0,0,0,0,0
1854,panggil,0,0,0,0,0,0
1855,salah bikin pilih om prabowo ai gerindra ya ikan buntel                 o o,1,0,1,0,0,0
1856,putar video pastor loncat mulu,0,0,0,0,0,0
1857,beliau raja hati orang cinta sehat semangat jokowi tuntas kerja,0,0,0,0,0,0
1858,ngebut but                 ci,0,0,0,0,0,0
1859,amin pagi mbak sylvia,0,0,0,0,0,0
1860,selamat pagi selamat pekan kawan kabar gembira sepe inya mbah owi tambah cucu nih mbak kahiyang,0,0,0,0,0,0
1861,ya,0,0,0,0,0,0
1862,tambah orang cabul kacamata,1,0,1,0,0,0
1863,selamat malam mbak kimmy waspada hati                 go a,1,1,0,0,0,0
1864,nc nih                 b sf,1,1,0,0,0,0
1865,al fatihah ibunda,0,0,0,0,0,0
1866,selamat ulang oshi sayang umur sehat bolee nakal ya amin,0,0,0,0,0,0
1867,islam indonesia cabik cabik ulah oknum anut rindu hadir ulama sepe i gus dur buya,0,0,0,0,0,0
1868,b ni cari latar belakang mentwit,0,0,0,0,0,0
1869,alhamdulillah bravo menteri agama proses hukum cabul pulici,0,0,0,0,0,0
1870,bos gelar honor causa,0,0,0,0,0,0
1871,santorinissun waahh bu retno menteri negeri ri                 si po,0,0,0,0,0,0
1872,mohmahfudmd                 z,0,0,0,0,0,0
1873,cnn indonesia baca tah presiden jokowi atur jarak lahir                 iya pergi,0,0,0,0,0,0
1874,orang nenek                 iya,0,0,0,0,0,0
1875,keju,0,0,0,0,0,0
1876,rumah kunti masuk angin,0,0,0,0,0,0
1877,kupi encer ya                 qc,0,0,0,0,0,0
1878,siang mbak luke                 s bm t,0,0,0,0,0,0
1879,iya we are bu retno pada                 kre wx,0,0,0,0,0,0
1880,gelar honor causa,0,0,0,0,0,0
1881,siaaanggg aman,0,0,0,0,0,0
1882,simpel siang nusantara,0,0,0,0,0,0
1883,cinta warga basuki amat jokowi rompi keren kinclong kena sinar matahari,0,0,0,0,0,0
1884,be ambah kandidat sila kompetisi sehat rakyat amat orang                 hl,0,0,0,0,0,0
1885,amin semangat bu,0,0,0,0,0,0
1886,sumbang                 g v,0,0,0,0,0,0
1887,warga salah sumber kuat keluarga botak belah kiri menteri ya basuki,0,0,0,0,0,0
1889,waahh indonesia kuliner,1,0,1,0,0,0
1890,keren siap rompi uji nyali nih,0,0,0,0,0,0
1891,hilmi ehe,0,0,0,0,0,0
1892,cabe rawit mahal teh,0,0,0,0,0,0
1893,selamat pagi hongkong tah,0,0,0,0,0,0
1894,jokowi kemenpu jalan tanah bayang maju ekonomi,0,0,0,0,0,0
1895,jokowi kiri basuki                 e,0,0,0,0,0,0
1896,jalan tanah jalan lingkar selatan nias bangun pajak terima kasih bantu ekonomi wilayah indonesia                 v c,0,0,0,0,0,0
1897,yogaadrianyoga judahlion mohmahfudmd asa kemarin diresuffle ganti mang bandar jengkol kerja akal,0,0,0,0,0,0
1898,selamat ya moga bangun jalan lingkar nias dampak positif ekonomi                 si a,0,0,0,0,0,0
1899,sejarah orang orang coba belok arah patut tampar,0,0,0,0,0,0
1900,panjianom innetamarani surga hongkong                 x,0,0,0,0,0,0
1901,panjianom innetamarani buset garangan mak emak banget tian sasongko bening mbak mana,0,0,0,0,0,0
1902,semangaattt                 i vo,0,0,0,0,0,0
1903,yogaadrianyoga judahlion mohmahfudmd,0,0,0,0,0,0
1904,sosialrepublik taofan pratama na dirs menteri agama ri salah,0,0,0,0,0,0
1905,senang lihat jokowi te awa bahagia tular jokowi unjung pasar rakyat nias sumatra utara rabu juli,0,0,0,0,0,0
1906,sosialrepublik taofan pratama na dirs menteri agama ri bera i salah jokowi ya menteri agama,0,0,0,0,0,0
1907,sosialrepublik taofan pratama na dirs menteri agama ri oke logika mas perintah mesti tambah kuota jamaah haji wajib siap,0,0,0,0,0,0
1908,sosialrepublik taofan pratama na dirs menteri agama ri oke jamaah haji cek sehat siap,0,0,0,0,0,0
1909,sosialrepublik taofan pratama na dirs menteri agama ri mas scroll tau jawab,0,0,0,0,0,0
1910,pendek simpel modis,0,0,0,0,0,0
1912,yam hati lo cepat gede bulu bikin,0,0,0,0,0,0
1913,tau jodoh sayang doa baik mensuppo nya cari jodoh,0,0,0,0,0,0
1914,santorinissun divhumas polisi republik indonesia mudah pas orang ya iya saran oknum serah,0,0,0,0,0,0
1915,selamat bahagia mas mbak sekar,0,0,0,0,0,0
1916,mata hukum                 si h,0,0,0,0,0,0
1917,ya mudah an pusat turun tangan kunjung presiden cepat proses,0,0,0,0,0,0
1918,taofan pratama na dirs menteri agama ri tambah kuota haji haji kemarin te unda pandemi kurang daftar tunggu haji kabul kuota kejar,1,1,0,1,0,0
1919,jokowi selamat pastor,1,1,0,0,0,0
1920,listyosigitp c ajimahameru negara kalah panci                 t,1,0,1,0,0,0
1921,taofan pratama na dirs menteri agama ri dimenge i,0,0,0,0,0,0
1922,depok lo,0,0,0,0,0,0
1923,pisah ya cebong tonton ngemil,0,0,0,0,0,0
1924,c ajimahameru selamat bhayangkara et labora presisi pregigi,0,0,0,0,0,0
1925,aseeekkk puppy atuh ya,1,1,0,0,0,0
1926,ssttt bryno,0,0,0,0,0,0
1927,waalaikum salam bude selamat sarap mochi the gank,1,1,0,0,0,0
1928,cantik,0,0,0,0,0,0
1929,hati jalan,0,0,0,0,0,0
1930,p,0,0,0,0,0,0
1931,amin selamat pagi,0,0,0,0,0,0
1932,siwe hem u v,0,0,0,0,0,0
1933,tempel permen karet,0,0,0,0,0,0
1934,alhamdulillah,0,0,0,0,0,0
1935,jokowi waalaikum salam ya,0,0,0,0,0,0
1936,presiden                 e,0,0,0,0,0,0
1937,selamat pagi bang raja mana,0,0,0,0,0,0
1938,amin mbak retno kabar selamat pagi                 l,0,0,0,0,0,0
1939,selamat pagi mas                 iya,0,0,0,0,0,0
1940,selamat pagi mas                 f,0,0,0,0,0,0
1941,waahh bos selamat pagi bang ronny,0,0,0,0,0,0
1942,selamat pagi bang lutfi                 ijj,0,0,0,0,0,0
1943,pagi mbak nunung                 k,0,0,0,0,0,0
1944,mbak selamat pagi,0,0,0,0,0,0
1945,selamat pagi cantik bikin uwuuuu titip elus sayang pipi doa moga malaikat jaga amin                 wm tau,0,0,0,0,0,0
1946,selamat pagi mbak sylvia                 lj,0,0,0,0,0,0
1947,kati amin selamat pagi mbak ve,0,0,0,0,0,0
1948,pagi mbak,0,0,0,0,0,0
1950,selamat pagi,0,0,0,0,0,0
1951,waahhh nih pagiii,1,1,0,0,0,0
1952,sat set sat set jago                 y,0,0,0,0,0,0
1953,bangun perempuan cinta biar manis menang hadap fakta pahit,0,0,0,0,0,0
1954,negara runtuh fitnah hoaks sebar terima kasih suara benar lelah cinta negeri selamat pagi jaga negara satu republik indonesia                 ec he h,0,0,0,0,0,0
1955,selamat istirahat koh                 x,0,0,0,0,0,0
1956,sakit tau et akhlak,0,0,0,0,0,0
1957,a oke,0,0,0,0,0,0
1958,listyosigitp divhumas polisi republik indonesia selamat bhayangkara taruh harap kerja pulici                 iya j,1,1,0,0,0,0
1959,halo bandit,0,0,0,0,0,0
1960,amin purwoke o purwoke o soto dekat jual keripik,0,0,0,0,0,0
1961,anakkolong,0,0,0,0,0,0
1962,indah                 ct,0,0,0,0,0,0
1963,love it terima kasih,0,0,0,0,0,0
1964,kudus nikmat soto,0,0,0,0,0,0
1965,kisanak sila,0,0,0,0,0,0
1966,santuyyy sila,0,0,0,0,0,0
1967,selamat bhayangkara hoegeng pulici tidur                 gue,0,0,0,0,0,0
1968,sila non muslim muslim,0,0,0,0,0,0
1969,bera i muslim non muslim beda jawab ya,0,0,0,0,0,0
1970,ya,0,0,0,0,0,0
1971,sepe i bawa rasulullah contoh kaum,0,0,0,0,0,0
1972,jenggot,0,0,0,0,0,0
1973,hmmm bangga budaya arab kisanak budaya arab sepe i positif contoh,0,0,0,0,0,0
1974,sapi pegang anies kurban sakit kulit tanduk syarat hewan kurban sehat,0,0,0,0,0,0
1975,a bh,0,0,0,0,0,0
1976,bosan dengar                 v mp,0,0,0,0,0,0
1977,anak kapiten pattimura lo bilang saudara tetangga,0,0,0,0,0,0
1978,maaf nyamuk tertawa,0,0,0,0,0,0
1979,mantan,0,0,0,0,0,0
1980,jokowi bahasa inggris,0,0,0,0,0,0
1981,kangen iya,0,0,0,0,0,0
1982,anakkolong maksud,0,0,0,0,0,0
1983,si,0,0,0,0,0,0
1984,teyengcekap buset body kepala sih onde kopong isi                 united kingdom,0,0,0,0,0,0
1985,oke langsung gede avanya ngamati,0,0,0,0,0,0
1986,amin selamat pagi kabar bidadari mungil                 ywi,0,0,0,0,0,0
1987,mbak sinta selamat pagi,0,0,0,0,0,0
1989,pagiiii,0,0,0,0,0,0
1990,amin selamat pagi mbak nuning,0,0,0,0,0,0
1991,pagi alas daun,0,0,0,0,0,0
1992,anakkolong boikot google,0,0,0,0,0,0
1993,o akhlak,0,0,0,0,0,0
1994,bah,0,0,0,0,0,0
1995,selamat pagi pekak whiskey tah,0,0,0,0,0,0
1996,pagi bonbon                 ds t,0,0,0,0,0,0
1997,ya cross google kelas detik the gank untung ya iya lempeng turun kapiten pattimura sejarah,1,1,0,0,0,0
1998,amin pagi mbak,0,0,0,0,0,0
1999,gara tol basuki nih                 sn,0,0,0,0,0,0
2000,kadang jenuh mentwit serius pagi bos,0,0,0,0,0,0
2001,iya bukti warga jawa agama katolik,0,0,0,0,0,0
2002,pagiii,0,0,0,0,0,0
2003,pagiii                 jh,0,0,0,0,0,0
2004,pagi bos                 a,0,0,0,0,0,0
2005,kang dicky amin pagiii,0,0,0,0,0,0
2006,amin selamat pagi mbak ve                 qi gue,0,0,0,0,0,0
2007,selamat pagi mbak juni,0,0,0,0,0,0
2008,ya iya mentwit percaya sumber kelas menteri negeri kapiten pattimura muslim,0,0,0,0,0,0
2009,basuki uwuuuu sehat ya                 w,0,0,0,0,0,0
2010,yesus orang kudus no debat selamat pagi negara satu republik indonesia,0,0,0,0,0,0
2011,ehe                 a,0,0,0,0,0,0
2012,blokir lepas blokir follow teman akun to,0,0,0,0,0,0
2013,kasih tau atuh rajin pakai facenya putih nama suka nama,1,0,1,0,0,0
2014,capt tjapoenglaut turun kapiten pattimura bicara maaf berita,0,0,0,0,0,0
2015,guling jantan betina nama,0,0,0,0,0,0
2016,punten capt beliau muslim                 vajhnt zh,0,0,0,0,0,0
2017,b kapiten pattimura muslim kapiten ambil                 vajhnt zh,0,0,0,0,0,0
2019,koh jimmy sehat,0,0,0,0,0,0
2020,apa masalah solusi,0,0,0,0,0,0
2021,goreng bos basi                 rj,1,1,0,0,0,0
2022,jahat banget salah,0,0,0,0,0,0
2023,dharmi leonita lestari cantik mbak heni budaya izin culung picnya ya hatur terima kasih                 z,0,0,0,0,0,0
2024,pesan te ulis for your information indonesia impor an besar ukraina halus jokowi usaha mie instan suka goreng kue harga                 h,0,0,0,0,0,0
2025,i p,0,0,0,0,0,0
2026,nama tah,0,0,0,0,0,0
2027,waahh oshi gede halo oshi,0,0,0,0,0,0
2028,gigi,0,0,0,0,0,0
2029,kocheng bumi coba main halaman bulu satu tanah gendut banget mabuk cucu,0,0,0,0,0,0
2030,diva negara satu republik indonesia bobbyandhika hem orang jadi meme doa mualaf lo                 jo,0,0,0,0,0,0
2031,buset ketua majelis ulama indonesia pusat mentwit malu kompor panas bos,0,0,0,0,0,0
2032,oke,0,0,0,0,0,0
2033,woohh neng lia sakit tah,0,0,0,0,0,0
2034,titip ucap selamat ulang ya tjapt selamat ulang cancer girl umur sehat bahagia cantik murah hati senyum                 b hw,0,0,0,0,0,0
2035,cerita atuh by the way minggu selamat ulang ya umur sehat ceria cepat temu anak amin                 malam romantis ijj,0,0,0,0,0,0
2036,punten salah patut apresiasi ya iya presiden jokowi pergi direspon positif,0,0,0,0,0,0
2037,prabowo ya kali tuju menteri prajurit ketua ai                 v re,1,1,0,0,0,0
2038,jokowi amin yess lega lihat presiden selamat ya pergi antar wakil presiden istri pulang sambut,0,0,0,0,0,0
2039,yess hasil,0,0,0,0,0,0
2040,amin langsung ya video call cucu,0,0,0,0,0,0
2041,iya bandung,0,0,0,0,0,0
2042,iya                 ls,0,0,0,0,0,0
2043,lega ya lihat beliau selamat capai langsung takziah                 e r,0,0,0,0,0,0
2044,amin                 coba,0,0,0,0,0,0
2045,weehhh moga lekas sembuh koh minum air biar badan,0,0,0,0,0,0
2046,pakai biar segar,0,0,0,0,0,0
2047,anak nih janji uang muka rumah sat set sat set das desember warga huni rumah senggol mas wali gibran twit,0,0,0,0,0,0
2048,mik cucu,0,0,0,0,0,0
2049,menteri negeri retno langsung takziah duka keluarga almarhum menteri tjahjo kumolo,0,0,0,0,0,0
2050,selamat presiden jokowi bese a rombong indonesia sabtu juli                 ey pqf,0,0,0,0,0,0
2051,saking,0,0,0,0,0,0
2052,ya biar kurang orang,0,0,0,0,0,0
2053,nih,1,1,0,0,0,0
2054,roosfeary almarhum tjahjo kumolo orang humble sederhana almarhum ajar bumi al fatihah,0,0,0,0,0,0
2055,pagi gajah pangling avanya happy pekan ya                 direct message iya co md,1,0,1,0,0,0
2056,ya,0,0,0,0,0,0
2057,barakallah,0,0,0,0,0,0
2058,bah lihat tah pagiii                 b,0,0,0,0,0,0
2059,oh iya nias banjir bandung keren lo mesjid tengah                 jvg,0,0,0,0,0,0
2060,main pasir hasil bos beliau nias kemarin,0,0,0,0,0,0
2061,anastasianuning selamat pagi mbak sunrise happy pekan                 j,0,0,0,0,0,0
2062,welcome home presiden bese a rombong                 gue,0,0,0,0,0,0
2063,selamat pagi,0,0,0,0,0,0
2064,selamat pagi mana tah mbak nuning,0,0,0,0,0,0
2065,sepe i jokowi bu retno kenal cape boleee ya bu tas catat isi bu tolak angin cream permen pokok bocor deh bu stamina bagus banget                 k wr k,0,0,0,0,0,0
2066,selamat pagi happy pekan kawan,0,0,0,0,0,0
